"Title","Author_Info","Journal","Year","Label"
"Addiction in Extreme Sports: An Exploration of Withdrawal States in Rock Climbers.","Heirene RM, et al.","J Behav Addict",2016,"extreme_sports"
"Commentary on: Addiction in extreme sports: An exploration of withdrawal states in rock climbers.","Buckley RC.","J Behav Addict",2016,"extreme_sports"
"Response to ""Nature fix: Addiction to outdoor activities""R. C. Buckley's commentary on Heirene, R. M., Shearer, D., Roderique-Davies, G., & Mellalieu, S. D. (2016). Addiction in extreme sports: An exploration of withdrawal states in rock climbers. Journal of Behavioral Addictions, 5, 332-341.","Heirene RM, et al.","J Behav Addict",2016,"extreme_sports"
"Development and Initial Validation of a Rock Climbing Craving Questionnaire (RCCQ).","Roderique-Davies G, et al.","Front Psychol",2018,"extreme_sports"
"[Social-psychological characteristics of different types addictive behavior].","Korolenko TP, et al.","Zh Nevrol Psikhiatr Im S S Korsakova",2019,"extreme_sports"
"Adventure Thrills are Addictive.","Buckley RC.","Front Psychol",2015,"extreme_sports"
"Why do we climb mountains? An exploration of features of behavioural addiction in mountaineering and the association with stress-related psychiatric disorders.","Habelt L, et al.","Eur Arch Psychiatry Clin Neurosci",2023,"extreme_sports"
