"Title","Author_Info","Journal_Year_Info"
"Prevalence of hypersexual behavior in Parkinson's disease patients: Not restricted to males and dopamine agonist use.","Cooper CA, et al.","Int J Gen Med. 2009."
"A meta-analysis examining the relations among pathological gambling, obsessive-compulsive disorder, and obsessive-compulsive traits.","Durdle H, et al.","Psychol Rep. 2008."
"Noradrenergic function in pathological gambling: blunted growth hormone response to clonidine.","Pallanti S, et al.","J Psychopharmacol. 2010."
"Recovery in pathological gambling: an imprecise concept.","Nower L, et al.","Subst Use Misuse. 2008."
"[Factors predisposing to pathological gambling].","Bukhanovskiĭ AO, et al.","Zh Nevrol Psikhiatr Im S S Korsakova. 2008."
"[Obsessive-compulsive spectrum disorders].","Barel MV.","Vertex. 2008."
"Treatment seeking among Ontario problem gamblers: results of a population survey.","Suurvali H, et al.","Psychiatr Serv. 2008."
"Response perseveration and ventral prefrontal sensitivity to reward and punishment in male problem gamblers and smokers.","de Ruiter MB, et al.","Neuropsychopharmacology. 2009."
"Pathological gambling, delusional parasitosis and adipsia as a post-haemorrhagic syndrome: a case report.","Floris G, et al.","Neurocase. 2008."
"Predicting response to opiate antagonists and placebo in the treatment of pathological gambling.","Grant JE, et al.","Psychopharmacology (Berl). 2008."
"Dopamine agonist increases risk taking but blunts reward-related brain activity.","Riba J, et al.","PLoS One. 2008."
"Prevalence of problem and pathological gambling in Parkinson's disease.","Crockford D, et al.","J Gambl Stud. 2008."
"Development and psychometric evaluation of a three-dimensional Gambling Motives Questionnaire.","Stewart SH, et al.","Addiction. 2008."
"Personality traits and disorders in pathological gamblers versus normal controls.","Sáez-Abad C, et al.","J Addict Dis. 2008."
"Evaluation of a Shortened South Oaks Gambling Screen in veterans with addictions.","Nelson KG, et al.","Psychol Addict Behav. 2008."
"Subtyping pathological gamblers on the basis of affective motivations for gambling: relations to gambling problems, drinking problems, and affective motivations for drinking.","Stewart SH, et al.","Psychol Addict Behav. 2008."
"American Indians and non-Indians playing a slot-machine simulation: effects of sensation seeking and payback percentage.","Gillis A, et al.","Am Indian Alsk Native Ment Health Res. 2008."
"[Pathological gambling: review of the recent research trends].","Körmendi A, et al.","Psychiatr Hung. 2007."
"Personality disorders and pathological gambling: a review and re-examination of prevalence rates.","Bagby RM, et al.","J Pers Disord. 2008."
"Psychometric properties of the inventory of gambling situations with a focus on gender and age differences.","Weiss LM, et al.","J Nerv Ment Dis. 2008."
"Reward pathways in Parkinson's disease: clinical and theoretical implications.","Torta DM, et al.","Psychiatry Clin Neurosci. 2008."
"Significant others and gambling treatment outcomes.","Ingle PJ, et al.","J Gambl Stud. 2008."
"Substance and psychiatric disorders among men and women repeat driving under the influence offenders who accept a treatment-sentencing option.","LaPlante DA, et al.","J Stud Alcohol Drugs. 2008."
"Olanzapine in the treatment of pathological gambling: a negative randomized placebo-controlled trial.","McElroy SL, et al.","J Clin Psychiatry. 2008."
"Urban elders and casino gambling: Are they at risk of a gambling problem?","Zaranek RR, et al.","J Aging Stud. 2008."
"Gambling, health and age: data from the National Epidemiologic Survey on Alcohol and Related Conditions.","Desai RA, et al.","Psychol Addict Behav. 2007."
"The performance of two pathological gambling screens in college students.","Weinstock J, et al.","Assessment. 2007."
"Exposure therapy for problem gambling via Videoconferencing: a case report.","Oakes J, et al.","J Gambl Stud. 2008."
"Excitement-seeking gambling in a nationally representative sample of recreational gamblers.","Pantalon MV, et al.","J Gambl Stud. 2008."
"Hormonal and genetic influences on processing reward and social information.","Caldú X, et al.","Ann N Y Acad Sci. 2007."
"Neurobiology of addiction. An integrative review.","Goodman A.","Biochem Pharmacol. 2008."
"An open-label trial of escitalopram in the treatment of pathological gambling.","Black DW, et al.","Clin Neuropharmacol. 2007."
"Risk factors for pathologic gambling and other compulsions among Parkinson's disease patients taking dopamine agonists.","Singh A, et al.","J Clin Neurosci. 2007."
"Medication-related impulse control and repetitive behaviors in Parkinson disease.","Voon V, et al.","Arch Neurol. 2007."
"Using a computer simulation of three slot machines to investigate a gambler's preference among varying densities of near-miss alternatives.","MacLin OH, et al.","Behav Res Methods. 2007."
"Schizophrenia and pathological gambling.","Borras L, et al.","Am J Addict. 2007."
"Pathological gambling and obsessive-compulsive disorder: towards a spectrum of disorders of volition.","Tavares H, et al.","Braz J Psychiatry. 2007."
"WITHDRAWN: Interventions for pathological gambling.","Oakley-Browne MA, et al.","Cochrane Database Syst Rev. 2007."
"Outcome of pharmacological treatments of pathological gambling: a review and meta-analysis.","Pallesen S, et al.","J Clin Psychopharmacol. 2007."
"Physiological effects of slot play in women.","Yucha C, et al.","Appl Psychophysiol Biofeedback. 2007."
"Lithium and topiramate association in the treatment of comorbid pathological gambling and bipolar disorder.","Nicolato R, et al.","Aust N Z J Psychiatry. 2007."
"Prevention of pathological gambling: a randomized controlled trial.","Doiron JP, et al.","Cogn Behav Ther. 2007."
"The role of self-reported impulsivity and reward sensitivity versus neurocognitive measures of disinhibition and decision-making in the prediction of relapse in pathological gamblers.","Goudriaan AE, et al.","Psychol Med. 2008."
"Treatment goal selection for female pathological gambling: a comparison of abstinence and controlled gambling.","Dowling N, et al.","J Gambl Stud. 2007."
"Adolescent pathological gambling in Kaunas, Lithuania.","Skokauskas N, et al.","Nord J Psychiatry. 2007."
"Demographic and clinical features of 150 pathological gamblers referred to a community addictions programme.","Teo P, et al.","Ann Acad Med Singap. 2007."
"Pathological gambling in Parkinson's disease.","O'Sullivan SS, et al.","Lancet Neurol. 2007."
"[Comorbidity in obsessive-compulsive disorder].","Raffray T, et al.","Rev Prat. 2007."
"Course of pathological gambling symptoms and reliability of the Lifetime Gambling History measure.","Sartor CE, et al.","Psychiatry Res. 2007."
"Gambling and substance use disorders: current status and future directions.","Petry NM.","Am J Addict. 2007."
"[Pathological gambling and personality disorders: a pilot-study with the MCMI-II].","Fernández Montalvo J, et al.","Psicothema. 2006."
"The five-factor gambling motivation model.","Lee HP, et al.","Psychiatry Res. 2007."
"Compulsive gamblers must get free NHS treatment, BMA says.","Hitchen L.","BMJ. 2007."
"A comparison of individual and group cognitive-behavioural treatment for female pathological gambling.","Dowling N, et al.","Behav Res Ther. 2007."
"Diagnostic instruments for behavioural addiction: an overview.","Albrecht U, et al.","Psychosoc Med. 2007."
"Pharmacotherapy of pathological gambling: review of new treatment modalities.","Lowengrub K, et al.","Expert Rev Neurother. 2006."
"The South Oaks Gambling Screen-revised Adolescent (SOGS-RA) revisited: a cut-point analysis.","Boudreau B, et al.","J Gambl Stud. 2007."
"Frequent card playing and pathological gambling: the utility of the Georgia Gambling Task and Iowa Gambling Task for predicting pathology.","Lakey CE, et al.","J Gambl Stud. 2007."
"The neurobiology of substance and behavioral addictions.","Grant JE, et al.","CNS Spectr. 2006."
"Dopamine agonists and pathological gambling.","Grosset KA, et al.","Parkinsonism Relat Disord. 2007."
"Prevalence of pathological gambling in patients with Parkinson's disease.","Avanzi M, et al.","Mov Disord. 2006."
"Medication management of pathological gambling.","Grant JE, et al.","Minn Med. 2006."
"Pathological gambling secondary to dopaminergic therapy in Parkinson's disease.","Drapier D, et al.","Psychiatry Res. 2006."
"Measurement of psychological disorders using cognitive diagnosis models.","Templin JL, et al.","Psychol Methods. 2006."
"Machines, medication, modulation: circuits of dependency and self-care in Las Vegas.","Schüll ND.","Cult Med Psychiatry. 2006."
"[Pathological gambling associated with pramipexole use in Parkinson's disease].","Lester J, et al.","Rev Neurol. 2006."
"Impulsivity and sustained attention in pathological gamblers: influence of childhood ADHD history.","Rodriguez-Jimenez R, et al.","J Gambl Stud. 2006."
"Preliminary evaluation of a coping skills training program for those with a pathological-gambling partner.","Rychtarik RG, et al.","J Gambl Stud. 2006."
"Association of dopamine agonist use with impulse control disorders in Parkinson disease.","Weintraub D, et al.","Arch Neurol. 2006."
"Prevalence and diagnostic correlates of DSM-IV pathological gambling in psychiatric outpatients.","Zimmerman M, et al.","J Gambl Stud. 2006."
"[Mental disorders in pathological gamblers].","Malygin VL, et al.","Zh Nevrol Psikhiatr Im S S Korsakova. 2006."
"Dopamine agonist therapy for Parkinson disease and pathological gambling.","Imamura A, et al.","Parkinsonism Relat Disord. 2006."
"Internet gambling: an emerging concern in family practice medicine?","Petry NM.","Fam Pract. 2006."
"Retaining pathological gamblers in cognitive behavior therapy through motivational enhancement: A pilot study.","Wulfert E, et al.","Behav Modif. 2006."
"Psychophysiological determinants and concomitants of deficient decision making in pathological gamblers.","Goudriaan AE, et al.","Drug Alcohol Depend. 2006."
"Queuing theory under competitive social foraging may explain a mathematical equivalence of delay and probability in impulsive decision-making.","Takahashi T.","Med Hypotheses. 2006."
"Convergent validity of measures of cognitive distortions, impulsivity, and time perspective with pathological gambling.","Mackillop J, et al.","Psychol Addict Behav. 2006."
"Heart rate increase to alcohol administration and video lottery terminal play among probable pathological gamblers and nonpathological gamblers.","Stewart SH, et al.","Psychol Addict Behav. 2006."
"A mathematical framework for probabilistic choice based on information theory and psychophysics.","Takahashi T.","Med Hypotheses. 2006."
"Neuropsychological performance, impulsivity, and comorbid psychiatric illness in patients with pathological gambling undergoing treatment at the CORE Inpatient Treatment Center.","Patterson JC 2nd, et al.","South Med J. 2006."
"Pathological gambling.","Desai RA.","South Med J. 2006."
"Multicenter investigation of the opioid antagonist nalmefene in the treatment of pathological gambling.","Grant JE, et al.","Am J Psychiatry. 2006."
"Pathological gambling: focusing on the addiction, not the activity.","Tamminga CA, et al.","Am J Psychiatry. 2006."
"Problem and pathological gambling among college athletes.","Kerber CS.","Ann Clin Psychiatry. 2005."
"[Efficiency of a gambling prevention program for youths: results from the pilot study].","Ferland F, et al.","Encephale. 2005."
"Gambling screens: does shortening the time frame affect their psychometric properties?","Wulfert E, et al.","J Gambl Stud. 2005."
"Cortisol and heart rate measures during casino gambling in relation to impulsivity.","Krueger TH, et al.","Neuropsychobiology. 2005."
"Bingeing rats: a model of intermittent excessive behavior?","Corwin RL.","Appetite. 2006."
"Outcome of psychological treatments of pathological gambling: a review and meta-analysis.","Pallesen S, et al.","Addiction. 2005."
"Alcohol's effects on video lottery terminal (VLT) play among probable pathological and non-pathological gamblers.","Ellery M, et al.","J Gambl Stud. 2005."
"Introduction to the special issue on ''relations between gambling and alcohol use''.","Stewart SH, et al.","J Gambl Stud. 2005."
"Comparison of craving between pathological gamblers and alcoholics.","Tavares H, et al.","Alcohol Clin Exp Res. 2005."
"On pathological gambling.","Lipsius LH.","Psychiatry (Edgmont). 2005."
"Childhood maltreatment in male and female treatment-seeking pathological gamblers.","Petry NM, et al.","Psychol Addict Behav. 2005."
"Pathological gambling caused by drugs used to treat Parkinson disease.","Dodd ML, et al.","Arch Neurol. 2005."
"Are dopaminergic genes involved in a predisposition to pathological aggression? Hypothesizing the importance of ""super normal controls"" in psychiatricgenetic research of complex behavioral disorders.","Chen TJ, et al.","Med Hypotheses. 2005."
"Effect of genes, environment, and lifetime co-occurring disorders on health-related quality of life in problem and pathological gamblers.","Scherrer JF, et al.","Arch Gen Psychiatry. 2005."
"Single units in the pigeon brain integrate reward amount and time-to-reward in an impulsive choice task.","Kalenscher T, et al.","Curr Biol. 2005."
"[Impulsivity and mental disorders].","Kisa C, et al.","Turk Psikiyatri Derg. 2005."
"Controlled gambling for pathological gamblers.","Ladouceur R.","J Gambl Stud. 2005."
"Evaluation and treatment of pathological gambling.","González-Ibáñez A, et al.","J Gambl Stud. 2005."
"Obsessive-compulsive disorder and spectrum across the life span.","Hollander E.","Int J Psychiatry Clin Pract. 2005."
"Problems with computer games without monetary reward: similarity to pathological gambling.","Johansson A, et al.","Psychol Rep. 2004."
"Pathological gambling and personality disorders: an exploratory study with the IPDE.","Fernández-Montalvo J, et al.","J Pers Disord. 2004."
"Gambling and suicidality in treatment-seeking pathological gamblers.","Ledgerwood DM, et al.","J Nerv Ment Dis. 2004."
"The SOGS-RA vs. the MAGS-7: prevalence estimates and classification congruence.","Langhinrichsen-Rohling J, et al.","J Gambl Stud. 2004."
"Psychosocial variables associated with adolescent gambling.","Hardoon KK, et al.","Psychol Addict Behav. 2004."
"A prospective study of problem and regular nonproblem gamblers living in the community.","Abbott MW, et al.","Subst Use Misuse. 2004."
"Comparisons between the South Oaks Gambling Screen and a DSM-IV-based interview in a community survey of problem gambling.","Cox BJ, et al.","Can J Psychiatry. 2004."
"Gambling behaviors in Black older adults: perceived effects on health.","Christensen MH, et al.","J Gerontol Nurs. 2004."
"Perceptions among pathological and nonpathological gamblers.","Ladouceur R.","Addict Behav. 2004."
"Problem gambling.","[No authors listed]","Harv Ment Health Lett. 2004."
"Pharmacotherapy outcome in older pathological gamblers: a preliminary investigation.","Grant JE, et al.","J Geriatr Psychiatry Neurol. 2004."
"Individual, family, and peer correlates of adolescent gambling.","Langhinrichsen-Rohling J, et al.","J Gambl Stud. 2004."
"Delay discounting by pathological gamblers.","Dixon MR, et al.","J Appl Behav Anal. 2003."
"Retrospective and prospective reports of precipitants to relapse in pathological gambling.","Hodgins DC, et al.","J Consult Clin Psychol. 2004."
"Assessment of pathological gamblers who use slot machines.","González-Ibáñez A, et al.","Psychol Rep. 2003."
"Distribution of the DSM-IV criteria for pathological gambling.","Rosenthal RJ.","Addiction. 2003."
"Females' coping styles and control over poker machine gambling.","Scannell ED, et al.","J Gambl Stud. 2000."
"Problem gambling and comorbid psychiatric and substance use disorders among drug users recruited from drug treatment and community settings.","Cunningham-Williams RM, et al.","J Gambl Stud. 2000."
"Gambling participation and problems among older adults.","Ladd GT, et al.","J Geriatr Psychiatry Neurol. 2003."
"Gambling participation and problems among South East Asian refugees to the United States.","Petry NM, et al.","Psychiatr Serv. 2003."
"Patterns and correlates of Gamblers Anonymous attendance in pathological gamblers seeking professional treatment.","Petry NM.","Addict Behav. 2003."
"Which pathological gamblers will complete treatment?","Leblond J, et al.","Br J Clin Psychol. 2003."
"The self-exclusion program: legal and clinical considerations.","Napolitano F.","J Gambl Stud. 2003."
"Problem Gambling Within a Chinese Speaking Community.","Blaszczynski A, et al.","J Gambl Stud. 1998."
"First Year Impacts of Casino Gambling in a Community.","Govoni R, et al.","J Gambl Stud. 1998."
"Personality Disorders Among Pathological Gamblers.","Blaszczynski A, et al.","J Gambl Stud. 1998."
"Gender differences in pathological gambling.","Ibáñez A, et al.","J Clin Psychiatry. 2003."
"Group therapy for pathological gamblers: a cognitive approach.","Ladouceur R, et al.","Behav Res Ther. 2003."
"Exaggerated ethanol-induced cardiac reactivity as an indicator of increased risk for gambling.","Brunelle C, et al.","Psychol Addict Behav. 2003."
"Neurodevelopment, impulsivity, and adolescent gambling.","Chambers RA, et al.","J Gambl Stud. 2003."
"Quality of life and family history in pathological gambling.","Black DW, et al.","J Nerv Ment Dis. 2003."
"Nefazodone treatment of pathological gambling: a prospective open-label controlled trial.","Pallanti S, et al.","J Clin Psychiatry. 2002."
"Concurrent positive association between pathological gambling and functional DNA polymorphisms at the MAO-A and the 5-HT transporter genes.","Pérez de Castro I, et al.","Mol Psychiatry. 2002."
"Pathological gambling. A comprehensive review.","Raylu N, et al.","Clin Psychol Rev. 2002."
"Lithium and valproate treatment of pathological gambling: a randomized single-blind study.","Pallanti S, et al.","J Clin Psychiatry. 2002."
"The effect of compliance-improving interventions on the cognitive-behavioural treatment of pathological gambling.","Milton S, et al.","J Gambl Stud. 2002."
"A double-blind placebo-controlled study of the efficacy and safety of paroxetine in the treatment of pathological gambling.","Kim SW, et al.","J Clin Psychiatry. 2002."
"Problem and pathological gambling.","Blansfield HN.","Conn Med. 2002."
"Rapid onset of pathological gambling in machine gamblers.","Breen RB, et al.","J Gambl Stud. 2002."
"A pilot placebo-controlled study of fluvoxamine for pathological gambling.","Blanco C, et al.","Ann Clin Psychiatry. 2002."
"Impulse control disorders and depression.","Lejoyeux M, et al.","J Nerv Ment Dis. 2002."
"Compulsive gambling: a women's health risk.","Millius A.","Kans Nurse. 2000."
"Comorbid mental disorders among the patients with alcohol abuse and dependence in Korea.","Cho MJ, et al.","J Korean Med Sci. 2002."
"[Pathological gambling].","Fekjaer HO.","Tidsskr Nor Laegeforen. 2001."
"Gambling in mild-moderate alcohol-dependent outpatients.","Sellman JD, et al.","Subst Use Misuse. 2002."
"Manipulations of the features of standard video lottery terminal (VLT) games: effects in pathological and non-pathological gamblers.","Loba P, et al.","J Gambl Stud. 2001."
"An open-label study of citalopram in the treatment of pathological gambling.","Zimmerman M, et al.","J Clin Psychiatry. 2002."
"Modification in the proposed diagnostic criteria for Internet addiction.","Beard KW, et al.","Cyberpsychol Behav. 2001."
"Gender differences in gambling progression.","Tavares H, et al.","J Gambl Stud. 2001."
"Cognitive changes in pathological gamblers following a 28-day inpatient program.","Breen RB, et al.","Psychol Addict Behav. 2001."
"Pathological gamblers, with and without substance use disorders, discount delayed rewards at high rates.","Petry NM.","J Abnorm Psychol. 2001."
"A behavioral approach to understanding and treating pathological gambling.","Petry NM, et al.","Semin Clin Neuropsychiatry. 2001."
"A twin study of the association between pathological gambling and antisocial personality disorder.","Slutske WS, et al.","J Abnorm Psychol. 2001."
"Underlying cognitions in the selection of lottery tickets.","Hardoon KK, et al.","J Clin Psychol. 2001."
"Substance abuse, pathological gambling, and impulsiveness.","Petry NM.","Drug Alcohol Depend. 2001."
"Impact of availability on gambling: a longitudinal study.","Jacques C, et al.","Can J Psychiatry. 2000."
"Contemporary issues and future directions for research into pathological gambling.","Dickerson M, et al.","Addiction. 2000."
"Common genetic vulnerability for pathological gambling and alcohol dependence in men.","Slutske WS, et al.","Arch Gen Psychiatry. 2000."
"Identifying office resource needs of Canadian physicians to help prevent, assess and treat patients with substance use and pathological gambling disorders.","Rowan MS, et al.","J Addict Dis. 2000."
"Impulsivity predicts problem gambling in low SES adolescent males.","Vitaro F, et al.","Addiction. 1999."
"Studies of the 48 bp repeat polymorphism of the DRD4 gene in impulsive, compulsive, addictive behaviors: Tourette syndrome, ADHD, pathological gambling, and substance abuse.","Comings DE, et al.","Am J Med Genet. 1999."
"Pathological gambling and obsessive-compulsive spectrum disorders.","Blaszczynski A.","Psychol Rep. 1999."
"The reification of the ""pathological"" gambler: an analysis of gambling treatment and the application of the medical model to problem gambling.","Wedgeworth RL.","Perspect Psychiatr Care. 1998."
"Short-term single-blind fluvoxamine treatment of pathological gambling.","Hollander E, et al.","Am J Psychiatry. 1998."
"Impulsivity, personality disorders and pathological gambling severity.","Steel Z, et al.","Addiction. 1998."
"Association of obsessive-compulsive disorder and pathological gambling with Huntington's disease in an Italian pedigree: possible association with Huntington's disease mutation.","De Marchi N, et al.","Acta Psychiatr Scand. 1998."
"The most important unresolved issue in the addictions: conceptual chaos.","Shaffer HJ.","Subst Use Misuse. 1997."
"Pathological gambling, When do social issues become medical issues?","Setness PA.","Postgrad Med. 1997."
"Sex differences in pathological gambling using gaming machines.","Ohtsuka K, et al.","Psychol Rep. 1997."
"[An interview study of close relatives of pathological gamblers: the worst is to feel deceived and cheated].","Jonsson J.","Lakartidningen. 1997."
"[Professor Conny Nordin: pathological gambling--a challenging phenomenon!].","Lind J.","Lakartidningen. 1997."
"The Lie/Bet Questionnaire for screening pathological gamblers.","Johnson EE, et al.","Psychol Rep. 1997."
"Video lottery gambling: Effects on pathological gamblers seeking treatment in South Dakota.","Morgan T, et al.","J Gambl Stud. 1996."
"Potential and probable pathological gamblers: Where do the differences lie?","Dubé D, et al.","J Gambl Stud. 1996."
"Pathological gambling: a review of the literature.","Griffiths M.","J Psychiatr Ment Health Nurs. 1996."
"Medical approaches to gambling issues--I: The medical condition.","Miller MM.","Wis Med J. 1996."
"Wisconsin must act on compulsive gambling.","Black S.","Wis Med J. 1996."
"Pathological gambling in hospitalized substance abusing veterans.","Daghestani AN, et al.","J Clin Psychiatry. 1996."
"Pathological gamblers and alcoholics: do they share the same addictions?","Briggs JR, et al.","Addict Behav. 1996."
"The D2 dopamine receptor gene as a determinant of reward deficiency syndrome.","Blum K, et al.","J R Soc Med. 1996."
"The prevalence of pathological gambling in Canada.","Ladouceur R.","J Gambl Stud. 1996."
"Pathological gambling: forensic issues.","Blaszczynski A, et al.","Aust N Z J Psychiatry. 1996."
"[Pathologic gambling].","Nespor K.","Cas Lek Cesk. 1996."
"Comparative study of problematic gambling behaviors between American Indian and non-Indian adults in a Northern Plains reservation.","Zitzow D.","Am Indian Alsk Nativ Ment Health Res (1987). 1996."
"Pathological gambling among methadone patients.","Feigelman W, et al.","Drug Alcohol Depend. 1995."
"Cognitive and behavioral therapies for pathological gambling.","Blaszczynski A, et al.","J Gambl Stud. 1995."
"Dopamine D2 receptor gene variants: association and linkage studies in impulsive-addictive-compulsive behaviour.","Blum K, et al.","Pharmacogenetics. 1995."
"Social cost of pathological gambling.","Ladouceur R, et al.","J Gambl Stud. 1994."
"Gambling among primary school students.","Ladouceur R, et al.","J Gambl Stud. 1994."
"Access to gambling opportunities and compulsive gambling.","Lester D.","Int J Addict. 1994."
"Pathological gamblers--will they use a new telephone hotline?","Sullivan S, et al.","N Z Med J. 1994."
"Transference and countertransference reactions in the psychotherapy of pathological gamblers.","Rugle LJ, et al.","J Gambl Stud. 1994."
"The crisis of addictive gambling in New Jersey.","Russell HJ, et al.","N J Med. 1993."
"Evaluation of a prevention program for pathological gambling among adolescents.","Gaboury A, et al.","J Prim Prev. 1993."
"Insights about pathological gamblers. 'Chasing losses' in spite of the consequences.","Cusack JR, et al.","Postgrad Med. 1993."
"Neuropsychological assessment of attention problems in pathological gamblers.","Rugle L, et al.","J Nerv Ment Dis. 1993."
"Recent developments in alcoholism:psychodynamic approaches.","Brehm N, et al.","Recent Dev Alcohol. 1993."
"The Rotter I-E scale as a predictor of relapse in a population of compulsive gamblers.","Johnson EE, et al.","Psychol Rep. 1992."
"Prevalence estimates of pathological gambling in Seville (Spain).","Legarda JJ, et al.","Br J Addict. 1992."
"Treatment of pathological gambling with clomipramine.","Hollander E, et al.","Am J Psychiatry. 1992."
