"Title","Author_Info","Journal_Year_Info"
"Comorbidity, family history and personality traits in pathological gamblers compared with healthy controls.","Mann K, et al.","Eur Psychiatry. 2017."
"Relationship between pathological gambling, alexithymia, and gambling type.","Bonnaire C, et al.","Am J Addict. 2017."
"Management of impulse control disorders with deep brain stimulation: A double-edged sword.","Kasemsuk C, et al.","J Neurol Sci. 2017."
"Online and live regular poker players: Do they differ in impulsive sensation seeking and gambling practice?","Barrault S, et al.","J Behav Addict. 2016."
"Mood, motives, and money: An examination of factors that differentiate online and non-online young adult gamblers.","Goldstein AL, et al.","J Behav Addict. 2016."
"Right inferior frontal cortex activity correlates with tolcapone responsivity in problem and pathological gamblers.","Kayser AS, et al.","Neuroimage Clin. 2016."
"Dopamine and Opioid Neurotransmission in Behavioral Addictions: A Comparative PET Study in Pathological Gambling and Binge Eating.","Majuri J, et al.","Neuropsychopharmacology. 2017."
"Strong interactions between learned helplessness and risky decision-making in a rat gambling model.","Nobrega JN, et al.","Sci Rep. 2016."
"Neuronal Nicotinic Receptors Are Crucial for Tuning of E/I Balance in Prelimbic Cortex and for Decision-Making Processes.","Pittaras EC, et al.","Front Psychiatry. 2016."
"Assessing the effects of cocaine dependence and pathological gambling using group-wise sparse representation of natural stimulus FMRI data.","Ren Y, et al.","Brain Imaging Behav. 2017."
"Introduction to Parkinson disease (PD) and its complications.","Marvanova M.","Ment Health Clin. 2016."
"Psychopathology of Online Poker Players: Review of Literature.","Moreau A, et al.","J Behav Addict. 2016."
"Comorbidity of Alcohol and Gambling Problems in Emerging Adults: A Bifactor Model Conceptualization.","Tackett JL, et al.","J Gambl Stud. 2017."
"Risk-Taking, Delay Discounting, and Time Perspective in Adolescent Gamblers: An Experimental Study.","Cosenza M, et al.","J Gambl Stud. 2017."
"Cue-induced Behavioral and Neural Changes among Excessive Internet Gamers and Possible Application of Cue Exposure Therapy to Internet Gaming Disorder.","Zhang Y, et al.","Front Psychol. 2016."
"Exposure to Gambling Advertisements and Gambling Behavior in Young People.","Clemens F, et al.","J Gambl Stud. 2017."
"Strategic Versus Nonstrategic Gambling: Results From a Community Survey.","Subramaniam M, et al.","J Addict Med. 2016."
"[ADH/D and impulsiveness: Prevalence of impulse control disorders and other comorbidities, in 81 adults with attention deficit/hyperactivity disorder (ADH/D)].","Porteret R, et al.","Encephale. 2016."
"Decision-Making, Cognitive Distortions and Alcohol Use in Adolescent Problem and Non-problem Gamblers: An Experimental Study.","Ciccarelli M, et al.","J Gambl Stud. 2016."
"The association between pathological gambling and suicidality in treatment-seeking pathological gamblers in South Africa.","Stein GN, et al.","Ann Clin Psychiatry. 2016."
"Type of gambling as an independent risk factor for suicidal events in pathological gamblers.","Bischof A, et al.","Psychol Addict Behav. 2016."
"Impaired non-verbal emotion processing in Pathological Gamblers.","Kornreich C, et al.","Psychiatry Res. 2016."
"Impact of Impulse Control Disorders on Sleep-Wake Regulation in Parkinson's Disease.","Djamshidian A, et al.","Parkinsons Dis. 2015."
"Neurobiological correlates of internet gaming disorder: Similarities to pathological gambling.","Fauth-Bühler M, et al.","Addict Behav. 2017."
"Internet based personalized feedback interventions for gamblers in Singapore: First results.","Zhang MW, et al.","Technol Health Care. 2016."
"Transcranial direct current stimulation (tDCS) in behavioral and food addiction: a systematic review of efficacy, technical, and methodological issues.","Sauvaget A, et al.","Front Neurosci. 2015."
"Abnormal behaviours during pramipexole treatment for Cotard's syndrome: a case report.","Maruo J, et al.","Psychogeriatrics. 2016."
"Working memory, executive function and impulsivity in Internet-addictive disorders: a comparison with pathological gambling.","Zhou Z, et al.","Acta Neuropsychiatr. 2016."
"[Epidemiology of addictive disorders and behaviors in Japan].","Osaki Y, et al.","Nihon Rinsho. 2015."
"Social and behavioral problems among five gambling severity groups.","Moghaddam JF, et al.","Psychiatry Res. 2015."
"New Onset of Compulsive Gambling Associated With Modafinil: A Case Report.","George WT, et al.","Prim Care Companion CNS Disord. 2015."
"Patterns and trends in gambling participation in the Quebec population between 2009 and 2012.","Kairouz S, et al.","Can J Public Health. 2015."
"[Play behavior in people with various degrees of pathological gambling risk].","Prilutskaya MV, et al.","Zh Nevrol Psikhiatr Im S S Korsakova. 2015."
"Suicide Ideations, Suicide Attempts, and Completed Suicide in Persons with Pathological Gambling and Their First-Degree Relatives.","Black DW, et al.","Suicide Life Threat Behav. 2015."
"[Qualitative evaluation of TAMARPP, the relapse prevention program for substance abusers at the Mental Health and Welfare Center].","Taniai T, et al.","Nihon Arukoru Yakubutsu Igakkai Zasshi. 2014."
"Suicidal ideation and suicide attempts in five groups with different severities of gambling: Findings from the National Epidemiologic Survey on Alcohol and Related Conditions.","Moghaddam JF, et al.","Am J Addict. 2015."
"Repetitive transcranial magnetic stimulation to treat substance use disorders and compulsive behavior.","Protasio MI, et al.","CNS Neurol Disord Drug Targets. 2015."
"Pet killing as a manifestation of impulse control disorder secondary to pramipexol.","Micheli F, et al.","Clin Neuropharmacol. 2015."
"Masochism and pathological gambling.","Rosenthal RJ.","Psychodyn Psychiatry. 2015."
"[Adolescent pathological gambling].","Petit A, et al.","Arch Pediatr. 2015."
"The neural basis of impulsive discounting in pathological gamblers.","Miedl SF, et al.","Brain Imaging Behav. 2015."
"[Mediating role of emotional regulation between impulsive behavior in gambling, Internet and videogame abuse, and dysfunctional symptomatology in young adults and adolescents].","Estévez Gutiérrez A, et al.","Adicciones. 2014."
"Dopaminergic function and intertemporal choice.","Joutsa J, et al.","Transl Psychiatry. 2015."
"Predicting treatment failure in pathological gambling: the role of personality traits.","Ramos-Grille I, et al.","Addict Behav. 2015."
"Associations between Antisocial Personality Disorder and Sex on Discounting Rates.","Andrade LF, et al.","Psychol Rec. 2014."
"[Migration and Addiction Services--Utilization Among People with a Migration Background].","Rommel A, et al.","Psychiatr Prax. 2016."
"Reports of pathological gambling, hypersexuality, and compulsive shopping associated with dopamine receptor agonist drugs.","Moore TJ, et al.","JAMA Intern Med. 2014."
"Factors Associated with Suicide and Bankruptcy in Japanese Pathological Gamblers.","Komoto Y.","Int J Ment Health Addict. 2014."
"Role of ionotropic glutamate receptors in delay and probability discounting in the rat.","Yates JR, et al.","Psychopharmacology (Berl). 2015."
"Translational research into intertemporal choice: the Western scrub-jay as an animal model for future-thinking.","Thom JM, et al.","Behav Processes. 2015."
"Deficits in behavioural inhibition in substance abuse and addiction: a meta-analysis.","Smith JL, et al.","Drug Alcohol Depend. 2014."
"A Gamblers Clustering Based on Their Favorite Gambling Activity.","Challet-Bouju G, et al.","J Gambl Stud. 2015."
"[The characteristics of and social support for pathological gamblers among ""pachinko"" or ""slot"" users in Japan].","Kumagami T.","Seishin Shinkeigaku Zasshi. 2014."
"Differences between early-onset pathological gambling and later-onset pathological gambling: data from the National Epidemiologic Survey on Alcohol and Related Conditions (NESARC).","Verdura Vizcaíno EJ, et al.","Addiction. 2014."
"Increased risk of impulse control symptoms in Parkinson's disease with REM sleep behaviour disorder.","Fantini ML, et al.","J Neurol Neurosurg Psychiatry. 2015."
"Bet on sleep for the understanding of pathological gambling.","Tufik SB, et al.","J Psychiatr Res. 2014."
"A new approach to assess gambling-like behavior in laboratory rats: using intracranial self-stimulation as a positive reinforcer.","Tedford SE, et al.","Front Behav Neurosci. 2014."
"Stages of change, clinical presentation, retention, and treatment outcomes in treatment-seeking outpatient problem gambling clients.","Soberay AD, et al.","Psychol Addict Behav. 2014."
"An 8-week stress management program in pathological gamblers: a pilot randomized controlled trial.","Linardatou C, et al.","J Psychiatr Res. 2014."
"The role of dopamine in risk taking: a specific look at Parkinson's disease and gambling.","Clark CA, et al.","Front Behav Neurosci. 2014."
"Prefrontal control and internet addiction: a theoretical model and review of neuropsychological and neuroimaging findings.","Brand M, et al.","Front Hum Neurosci. 2014."
"Gambling in Brazil: a call for an open debate.","Tavares H.","Addiction. 2014."
"Abstinence versus Moderation Goals in Brief Motivational Treatment for Pathological Gambling.","Stea JN, et al.","J Gambl Stud. 2015."
"Endogenous cortisol levels are associated with an imbalanced striatal sensitivity to monetary versus non-monetary cues in pathological gamblers.","Li Y, et al.","Front Behav Neurosci. 2014."
"Food-cue affected motor response inhibition and self-reported dieting success: a pictorial affective shifting task.","Meule A, et al.","Front Psychol. 2014."
"Gambling onset and progression in a sample of at-risk gamblers from the general population.","Carneiro E, et al.","Psychiatry Res. 2014."
"Prevalence of suicide attempts in pathological gamblers in a nationwide Austrian treatment sample.","Thon N, et al.","Gen Hosp Psychiatry. 2014."
"Is Internet addiction a psychopathological condition distinct from pathological gambling?","Tonioni F, et al.","Addict Behav. 2014."
"An Examination of a Proposed DSM-IV Pathological Gambling Hierarchy in a Treatment Seeking Population: Similarities with Substance Dependence and Evidence for Three Classification Systems.","Christensen DR, et al.","J Gambl Stud. 2015."
"Neurological correlates of slot machine win size in pathological gamblers.","Dixon MR, et al.","Behav Processes. 2014."
"Gambling and perceived health among adult jail inmates.","Hickey K, et al.","J Forensic Nurs. 2014."
"A direct, controlled, blind family study of DSM-IV pathological gambling.","Black DW, et al.","J Clin Psychiatry. 2014."
"Dysfunctional decision-making in pathological gambling: pattern specificity and the role of impulsivity.","Kräplin A, et al.","Psychiatry Res. 2014."
"Association of sociodemographic, psychopathological and gambling-related factors with treatment utilization for pathological gambling.","Bischof A, et al.","Eur Addict Res. 2014."
"[Impulse control disorders in Parkinson's disease].","Joutsa J, et al.","Duodecim. 2013."
"Anhedonia in Parkinson's disease patients with and without pathological gambling: a case-control study.","Pettorruso M, et al.","Psychiatry Res. 2014."
"[Women and gambling: an overview].","Odoardi S, et al.","Recenti Prog Med. 2013."
"In vivo evidence for greater amphetamine-induced dopamine release in pathological gambling: a positron emission tomography study with [(11)C]-(+)-PHNO.","Boileau I, et al.","Mol Psychiatry. 2014."
"Psychiatric co-morbidity in problem and pathological gamblers: investigating the confounding influence of alcohol use disorder.","Abdollahnejad R, et al.","Addict Behav. 2014."
"Desensitization of triggers and urge reprocessing for pathological gambling: a case series.","Bae H, et al.","J Gambl Stud. 2015."
"Investigating risk factors for Internet gaming disorder: a comparison of patients with addictive gaming, pathological gamblers and healthy controls regarding the big five personality traits.","Müller KW, et al.","Eur Addict Res. 2014."
"[The Hungarian version of the Problem Gambling Severity Index (PGSI-HU)].","Gyollai A, et al.","Psychiatr Hung. 2013."
"Opioidergic and dopaminergic manipulation of gambling tendencies: a preliminary study in male recreational gamblers.","Porchet RI, et al.","Front Behav Neurosci. 2013."
"Impulse control disorder in a patient on long-term treatment with bromocriptine for a macroprolactinoma.","Thondam SK, et al.","Clin Neuropharmacol. 2013."
"[Non-motor symptoms in Parkinson's disease: cognition and behavior].","Bonnet AM, et al.","Geriatr Psychol Neuropsychiatr Vieil. 2013."
"Impulsivity and related neuropsychological features in regular and addictive first person shooter gaming.","Metcalf O, et al.","Cyberpsychol Behav Soc Netw. 2014."
"Decision-making deficits in pathological gambling: the role of executive functions, explicit knowledge and impulsivity in relation to decisions made under ambiguity and risk.","Ochoa C, et al.","Am J Addict. 2013."
"The future is now: comparing the effect of episodic future thinking on impulsivity in lean and obese individuals.","Daniel TO, et al.","Appetite. 2013."
"Cross-species approaches to pathological gambling: a review targeting sex differences, adolescent vulnerability and ecological validity of research tools.","van den Bos R, et al.","Neurosci Biobehav Rev. 2013."
"Typologies of young pathological gamblers based on sociodemographic and clinical characteristics.","Jiménez-Murcia S, et al.","Compr Psychiatry. 2013."
"Dopamine agonist withdrawal syndrome: implications for patient care.","Nirenberg MJ.","Drugs Aging. 2013."
"A case of frontotemporal dementia with amyotrophic lateral sclerosis presenting with pathological gambling.","Ozel-Kizil E, et al.","J Clin Neurol. 2013."
"Neurobiology of gambling behaviors.","Potenza MN.","Curr Opin Neurobiol. 2013."
"[Pathological gambling: social aspects].","Aĭmedov KV.","Zh Nevrol Psikhiatr Im S S Korsakova. 2013."
"Cocaine Dependent Individuals and Gamblers Present Different Associative Learning Anomalies in Feedback-Driven Decision Making: A Behavioral and ERP Study.","Torres A, et al.","Front Psychol. 2013."
"Harmful alcohol use and frequent use of marijuana among lifetime problem gamblers and the prevalence of cross-addictive behaviour among Greenland Inuit: evidence from the cross-sectional Inuit Health in Transition Greenland survey 2006-2010.","Larsen CV, et al.","Int J Circumpolar Health. 2013."
"Pathological gambling in Parkinson's disease. A comprehensive review.","Santangelo G, et al.","Parkinsonism Relat Disord. 2013."
"Altered paralimbic interaction in behavioral addiction.","Rømer Thomsen K, et al.","Proc Natl Acad Sci U S A. 2013."
"Neurocognitive mechanisms of impaired decision making in pathological gambling.","Dymond S, et al.","Front Psychiatry. 2013."
"Relapse in pathological gamblers: A pilot study on the predictive value of different impulsivity measures.","De Wilde B, et al.","J Behav Addict. 2013."
"A shorter and multidimensional version of the Gambling Attitudes and Beliefs Survey (GABS-23).","Bouju G, et al.","J Gambl Stud. 2014."
"Morphometric correlation of impulsivity in medial prefrontal cortex.","Cho SS, et al.","Brain Topogr. 2013."
"[Psychological and social impact of online gambling].","Lejoyeux M.","Bull Acad Natl Med. 2012."
"Low self-control and co-occurrence of gambling with substance use and delinquency among Chinese adolescents.","Cheung NW.","J Gambl Stud. 2014."
"Gambling proneness in rats during the transition from adolescence to young adulthood: a home-cage method.","Zoratto F, et al.","Neuropharmacology. 2013."
"Neural correlates of the impact of control on decision making in pathological gambling.","Hudgens-Haney ME, et al.","Biol Psychol. 2013."
"[Chemical and behavioural addiction of medical students. Comparative study in Lebanese students].","Moaouad J, et al.","Encephale. 2012."
"Psychological therapies for pathological and problem gambling.","Cowlishaw S, et al.","Cochrane Database Syst Rev. 2012."
"Correlates of depressive symptom severity in problem and pathological gamblers in couple relationships.","Poirier-Arbour A, et al.","J Gambl Stud. 2014."
"Telescoping phenomenon in pathological gambling: association with gender and comorbidities.","Grant JE, et al.","J Nerv Ment Dis. 2012."
"Gambling experiences, problems, research and policy: gambling in Germany.","Ludwig M, et al.","Addiction. 2013."
"Eating disorders and pathological gambling in males: can they be differentiated by means of weight history and temperament and character traits?","Claes L, et al.","Eat Disord. 2012."
"Cognitive-behavioral approaches to outpatient treatment of internet addiction in children and adolescents.","King DL, et al.","J Clin Psychol. 2012."
"[Factors influencing problem and pathological gambling in participants of horse race gambling].","Hyun MY, et al.","J Korean Acad Nurs. 2012."
"Gambling behaviors and perceived health among incarcerated older adults.","Kerber CH, et al.","J Psychosoc Nurs Ment Health Serv. 2012."
"Associations between pathological gambling and psychiatric comorbidity among help-seeking populations in Hong Kong.","Shek DT, et al.","ScientificWorldJournal. 2012."
"Gender-related clinical and neurocognitive differences in individuals seeking treatment for pathological gambling.","Grant JE, et al.","J Psychiatr Res. 2012."
"Comparison between immigrant and Spanish native-born pathological gambling patients.","Penelo E, et al.","Psychol Rep. 2012."
"Evaluation of a physical activity program for pathological gamblers in treatment.","Angelo DL, et al.","J Gambl Stud. 2013."
"Pathological gambling: a general overview.","Ashley LL, et al.","J Psychoactive Drugs. 2012."
"Striatal dopamine release codes uncertainty in pathological gambling.","Linnet J, et al.","Psychiatry Res. 2012."
"[Repetitive impulse-associated behavioral disorders in Parkinson's disease].","Katzenschlager R, et al.","Nervenarzt. 2012."
"Decision making, impulsivity, and addictions: do Parkinson's disease patients jump to conclusions?","Djamshidian A, et al.","Mov Disord. 2012."
"Investigating facets of personality in adult pathological gamblers with ADHD.","Davtian M, et al.","Neuropsychiatry (London). 2012."
"The role of memantine in the treatment of psychiatric disorders other than the dementias: a review of current preclinical and clinical evidence.","Sani G, et al.","CNS Drugs. 2012."
"A comparison of impulsivity and sensation seeking in pathological gamblers and skydivers.","Myrseth H, et al.","Scand J Psychol. 2012."
"Interpersonal guilt in college student pathological gamblers.","Locke GW, et al.","Am J Drug Alcohol Abuse. 2013."
"Pathological gambling: a systematic review of biochemical, neuroimaging, and neuropsychological findings.","Conversano C, et al.","Harv Rev Psychiatry. 2012."
"[Pathological gambling. Impulse control disorder, addiction or compulsion?].","Schoofs N, et al.","Nervenarzt. 2013."
"Personality disorders and dimensions in pathological gambling.","Odlaug BL, et al.","J Pers Disord. 2012."
"Comparison of impulsivity and working memory in cocaine addiction and pathological gambling: Implications for cocaine-induced neurotoxicity.","Albein-Urios N, et al.","Drug Alcohol Depend. 2012."
"Pathological gambling: prevalence, diagnosis, comorbidity, and intervention in Germany.","Erbas B, et al.","Dtsch Arztebl Int. 2012."
"Diminished aversive classical conditioning in pathological gamblers.","Brunborg GS, et al.","Addiction. 2012."
"Recreational gamblers with and without parental addiction.","Schreiber LR, et al.","Psychiatry Res. 2012."
"Alexithymia and gambling: a risk factor for all gamblers?","Bonnaire C, et al.","J Gambl Stud. 2013."
"Internet gambling, substance use, and delinquent behavior: an adolescent deviant behavior involvement pattern.","Brunelle N, et al.","Psychol Addict Behav. 2012."
"Mesolimbic dopamine release is linked to symptom severity in pathological gambling.","Joutsa J, et al.","Neuroimage. 2012."
"The Neuropsychopharmacology of Pathological Gambling.","Zakeri K, et al.","Curr Psychiatry Rev. 2012."
"Effects of acute pramipexole on male rats' preference for gambling-like rewards II.","Johnson PS, et al.","Exp Clin Psychopharmacol. 2012."
"Pramipexole-induced increased probabilistic discounting: comparison between a rodent model of Parkinson's disease and controls.","Rokosik SL, et al.","Neuropsychopharmacology. 2012."
"Frequency of gambling problems among parents of pathological, versus nonpathological, casino gamblers using slot machines.","Versini A, et al.","Am J Addict. 2012."
"[To an integrative management of pathological gamblers].","Bonnaire C.","Encephale. 2011."
"Role of genetic polymorphisms of the dopaminergic system in Parkinson's disease patients with impulse control disorders.","Vallelunga A, et al.","Parkinsonism Relat Disord. 2012."
"Neural correlates of pathological gamblers preference for immediate rewards during the iowa gambling task: an fMRI study.","Power Y, et al.","J Gambl Stud. 2012."
"[Pathological gambling: risk factors].","Bouju G, et al.","Encephale. 2011."
"Delay and probability discounting in pathological gamblers with and without a history of substance use problems.","Andrade LF, et al.","Psychopharmacology (Berl). 2012."
"Serotonin 1B receptor imaging in pathological gambling.","Potenza MN, et al.","World J Biol Psychiatry. 2013."
"Drinking patterns of pathological gamblers before, during, and after gambling treatment.","Rash CJ, et al.","Psychol Addict Behav. 2011."
"[Disulfiram and addiction: reminders and new perspectives of use].","Charpeaud T, et al.","Therapie. 2011."
"Association study on pathological gambling and polymorphisms of dopamine D1, D2, D3, and D4 receptor genes in a Korean population.","Lim S, et al.","J Gambl Stud. 2012."
"Pathological gambling in Parkinson's disease: disease related or drug related?","Calandrella D, et al.","Expert Rev Neurother. 2011."
"Pathological gambling plus hypersexuality in restless legs syndrome: a new case.","d'Orsi G, et al.","Neurol Sci. 2011."
"How do prescription opioid users differ from users of heroin or other drugs in psychopathology: results from the National Epidemiologic Survey on Alcohol and Related Conditions.","Wu LT, et al.","J Addict Med. 2011."
"Male batterers' alcohol use and gambling behavior.","Brasfield H, et al.","J Gambl Stud. 2012."
"[Impulse control disorders in Parkinson's disease].","Van den Heuvel OA, et al.","Tijdschr Psychiatr. 2011."
"Pathological gambling in a psychiatric sample.","Aragay N, et al.","Compr Psychiatry. 2012."
"A double-blind, placebo-controlled trial of topiramate for pathological gambling.","Berlin HA, et al.","World J Biol Psychiatry. 2013."
"Impulse control disorders in Parkinson disease: a multicenter case--control study.","Voon V, et al.","Ann Neurol. 2011."
"Delay discounting and gambling.","Madden GJ, et al.","Behav Processes. 2011."
"Treatment of pathological gambling with disulfiram: a report of 2 cases.","Müller CA, et al.","Pharmacopsychiatry. 2011."
"Dopamine agonist-triggered pathological behaviors: surveillance in the PD clinic reveals high frequencies.","Hassan A, et al.","Parkinsonism Relat Disord. 2011."
"Cigarette smoking status in pathological gamblers: association with impulsivity and cognitive flexibility.","Mooney ME, et al.","Drug Alcohol Depend. 2011."
"Pathological gambling in patients with Parkinson's disease is associated with fronto-striatal disconnection: a path modeling analysis.","Cilia R, et al.","Mov Disord. 2011."
"Is pathological gambling in Parkinson's disease reduced by amantadine?","Lee JY, et al.","Ann Neurol. 2011."
"A(2A) adenosine receptor binding parameters in platelets from patients affected by pathological gambling.","Martini C, et al.","Neuropsychobiology. 2011."
"Pathological gambling and posttraumatic stress disorder: a study of the co-morbidity versus each alone.","Najavits LM, et al.","J Gambl Stud. 2011."
"Patient versus informant reporting of ICD symptoms in Parkinson's disease using the QUIP: validity and variability.","Papay K, et al.","Parkinsonism Relat Disord. 2011."
"Differences in the associations between gambling problem severity and psychiatric disorders among black and white adults: findings from the National Epidemiologic Survey on Alcohol and Related Conditions.","Barry DT, et al.","Am J Addict. 2011."
"[Socio-demographic and clinical assessment, and trajectory of a sample of French pathological gamblers].","Grall-Bronnec M, et al.","Encephale. 2010."
"Neurobehavioral evidence for the ""Near-Miss"" effect in pathological gamblers.","Habib R, et al.","J Exp Anal Behav. 2010."
"[Psychological treatment of gambling].","Khazaal Y.","Rev Med Suisse. 2010."
"Subtyping pathological gamblers based on impulsivity, depression, and anxiety.","Ledgerwood DM, et al.","Psychol Addict Behav. 2010."
"Inhibitory control and psychopathology: a meta-analysis of studies using the stop signal task.","Lipszyc J, et al.","J Int Neuropsychol Soc. 2010."
"[Pathological gambling--what do we know?].","Gisela Buchner U, et al.","Psychother Psychosom Med Psychol. 2011."
"The prevalence and clinical characteristics of pathological gambling in Parkinson's disease: an evidence-based review.","Barns Neurauter MP, et al.","Funct Neurol. 2010."
"Pathological gambling and compulsive buying: do they fall within an obsessive-compulsive spectrum?","Black DW, et al.","Dialogues Clin Neurosci. 2010."
"Partial agonist therapy in schizophrenia: relevance to diminished criminal responsibility.","Gavaudan G, et al.","J Forensic Sci. 2010."
"Treatments for PTSD and pathological gambling: what do patients want?","Najavits LM.","J Gambl Stud. 2011."
