"Title","Author_Info","Journal_Year_Info"
"The Role of Narcissism, Hyper-competitiveness and Maladaptive Coping Strategies on Male Adolescent Regular Gamblers: Two Mediation Models.","Pace U, et al.","J Gambl Stud. 2021."
"The Gambling Symptom Assessment Scale (G-SAS): a reliability and validity study.","Kim SW, et al.","Psychiatry Res. 2009."
"Striatal ups or downs? Neural correlates of monetary reward anticipation, cue reactivity and their interaction in alcohol use disorder and gambling disorder.","van Timmeren T, et al.","J Behav Addict. 2023."
"Making Change: Attempts to Reduce or Stop Gambling in a General Population Sample of People Who Gamble.","Hodgins DC, et al.","Front Psychiatry. 2022."
"Is Empathy Associated with Gambling and Its Addiction? A Scoping Review of Empirical Studies.","Wu AMS, et al.","J Gambl Stud. 2022."
"Changes in gambling behaviour and related problems in clients seeking help in outpatient addiction care: Results from a 36-month follow-up study in Bavaria.","Bickl AM, et al.","J Behav Addict. 2021."
"Gambling disorder seeking treatment patients and tobacco use in relation to clinical profiles.","Jiménez-Murcia S, et al.","Addict Behav. 2021."
"The β-adrenoceptor blocker propranolol ameliorates compulsive-like gambling behaviour in a rodent slot machine task: implications for iatrogenic gambling disorder.","Cocker PJ, et al.","Eur J Neurosci. 2019."
"A Spanish Validation of the Canadian Adolescent Gambling Inventory (CAGI).","Jiménez-Murcia S, et al.","Front Psychol. 2017."
"From symptoms to neurobiology: pathological gambling in the light of the new classification in DSM-5.","Romanczuk-Seiferth N, et al.","Neuropsychobiology. 2014."
"Targeting the glutamatergic system to treat pathological gambling: current evidence and future perspectives.","Pettorruso M, et al.","Biomed Res Int. 2014."
"Noninvasive stimulation of the ventromedial prefrontal cortex modulates rationality of human decision-making.","Kroker T, et al.","Sci Rep. 2022."
"Who Seeks Treatment When Medicine Opens the Door to Pathological Gambling Patients-Psychiatric Comorbidity and Heavy Predominance of Online Gambling.","Håkansson A, et al.","Front Psychiatry. 2017."
"Estimating the prevalence of problem gambling among older adults in Singapore.","Tse S, et al.","Psychiatry Res. 2013."
"Treatment of compulsive sexual behaviour with naltrexone and serotonin reuptake inhibitors: two case studies.","Raymond NC, et al.","Int Clin Psychopharmacol. 2002."
"Striatal dopamine D₂/D₃ receptor binding in pathological gambling is correlated with mood-related impulsivity.","Clark L, et al.","Neuroimage. 2012."
"Gambling severity predicts midbrain response to near-miss outcomes.","Chase HW, et al.","J Neurosci. 2010."
"Qualitative Experience of Self-Exclusion Programs: A Scoping Review.","Devault-Tousignant C, et al.","Int J Environ Res Public Health. 2023."
"Case Study Demonstration of the Potential Acceptability and Effectiveness of a Novel Telehealth Treatment for People Experiencing Gambling Harm.","Oakes J, et al.","Int J Environ Res Public Health. 2022."
"Gambling disorder and dissociative features: A systematic review and meta-analysis.","Rogier G, et al.","Psychol Addict Behav. 2021."
"The Effectiveness of Sinking Lid Policies in Reducing Gambling Expenditure.","Erwin C, et al.","J Gambl Stud. 2022."
"Family-based association analysis of serotonin genes in pathological gambling disorder: evidence of vulnerability risk in the 5HT-2A receptor gene.","Wilson D, et al.","J Mol Neurosci. 2013."
"Gender differences in pathological gamblers seeking medication treatment.","Grant JE, et al.","Compr Psychiatry. 2002."
"Comparative Analysis of Potential Risk Factors for at-Risk Gambling, Problem Gambling and Gambling Disorder among Current Gamblers-Results of the Austrian Representative Survey 2015.","Buth S, et al.","Front Psychol. 2017."
"Disruption of Reward Processing in Addiction : An Image-Based Meta-analysis of Functional Magnetic Resonance Imaging Studies.","Luijten M, et al.","JAMA Psychiatry. 2017."
"Comorbidity Patterns Among Patients With Opioid Use Disorder and Problem Gambling: ADHD Status Predicts Class Membership.","Silbernagl M, et al.","J Dual Diagn. 2019."
"Imaging the Gambling Brain.","Balodis IM, et al.","Int Rev Neurobiol. 2016."
"Subjective and Cardiovascular Responses to an Acute Laboratory Gambling Task in Men and Women.","Miller L, et al.","Front Psychiatry. 2022."
"Gambling Behaviour: Prevalence, Risk Factors and Relation with Acculturation in 2007-2018 North Cyprus Adult Household Surveys.","Çakıcı M, et al.","J Gambl Stud. 2021."
"Social strain, couple dynamics and gender differences in gambling problems: evidence from Chinese married couples.","Cheung NW.","Addict Behav. 2015."
"Methods of assessing craving to gamble: a narrative review.","Ashrafioun L, et al.","Psychol Addict Behav. 2012."
"Casino gambling increases heart rate and salivary cortisol in regular gamblers.","Meyer G, et al.","Biol Psychiatry. 2000."
"The genetics of addiction-a translational perspective.","Agrawal A, et al.","Transl Psychiatry. 2012."
"Drug-Induced Gambling Disorder: Epidemiology, Neurobiology, and Management.","Wolfschlag M, et al.","Pharmaceut Med. 2023."
"An empirical investigation of the Pathways Model of problem gambling through the conjoint use of self-reports and behavioural tasks.","Bonnaire C, et al.","J Behav Addict. 2022."
"Gambling and Gambling Problem Perception Questionnaire as a tool to evaluate professionals' attitudes towards problem gamblers and training programmes in Japan.","Katayama M, et al.","Nordisk Alkohol Nark. 2022."
"Neurochemistry of response inhibition and interference in gambling disorder: a preliminary study of γ-aminobutyric acid (GABA+) and glutamate-glutamine (Glx).","Weidacker K, et al.","CNS Spectr. 2021."
"Moderator effect of sex in the clustering of treatment-seeking patients with gambling problems.","Jiménez-Murcia S, et al.","Neuropsychiatr. 2020."
"Treatment of Gambling Disorders.","Yip SW, et al.","Curr Treat Options Psychiatry. 2014."
"[Examination of the Young maladaptive schemes in a group of Gamblers Anonymous].","Katona Z, et al.","Psychiatr Hung. 2012."
"GPR52 agonists attenuate ropinirole-induced preference for uncertain outcomes.","Russell B, et al.","Behav Neurosci. 2021."
"Kindling of the basolateral or central nucleus of the amygdala increases suboptimal choice in a rat gambling task and increases motor impulsivity in risk-preferring animals.","Tremblay M, et al.","Behav Brain Res. 2021."
"On the Processes Underlying the Relationship Between Alexithymia and Gambling Severity.","Noël X, et al.","J Gambl Stud. 2018."
"Altered hierarchical organization between empathy and gambling networks in disordered gamblers.","Zhou H, et al.","Front Psychiatry. 2023."
"Five-year follow-up on a sample of gamblers: predictive factors of relapse.","Grall-Bronnec M, et al.","J Behav Addict. 2021."
"Emotion regulation in emerging adult gamblers and its mediating role with depressive symptomology.","Marchica LA, et al.","J Affect Disord. 2019."
"Impulsivity moderates the effects of dopamine D2 and mixed D1-D2 antagonists in individuals with gambling disorder.","Zack M, et al.","J Psychopharmacol. 2019."
"Increased motor impulsivity in a rat gambling task during chronic ropinirole treatment: potentiation by win-paired audiovisual cues.","Tremblay M, et al.","Psychopharmacology (Berl). 2019."
"Gambling-related cognitive distortions predict level of function among US veterans seeking treatment for gambling disorders.","Shirk SD, et al.","Am J Addict. 2018."
"Substance use and addictive disorders in DSM-5 and ICD 10 and the draft ICD 11.","Saunders JB.","Curr Opin Psychiatry. 2017."
"Prevalence of Pathological Gambling among Alcohol Addicts in Outpatient Treatment in the City of Zagreb: a Cross-Sectional Study.","Bodor D, et al.","Psychiatr Danub. 2018."
"Impaired Awareness of Problem and Pathological Gambling: A Review.","Shah P, et al.","J Gambl Stud. 2020."
"Associations between Problematic Gambling, Gaming, and Internet Use: A Cross-Sectional Population Survey.","Karlsson J, et al.","J Addict. 2019."
"Prevalence and Possible Predictors of Gambling Disorder in a Sample of Students in the Healthcare Professions.","Scandroglio F, et al.","Int J Environ Res Public Health. 2022."
"Distinct motivations to seek out information in healthy individuals and problem gamblers.","Dezza IC, et al.","Transl Psychiatry. 2021."
"An Exploratory Study of Relationships Among Five-Factor Personality Measures and Forms of Gambling in Adults With and Without Probable Pathological Gambling.","Whiting SW, et al.","J Gambl Stud. 2019."
"A Reliability Generalization Meta-analysis of the South Oaks Gambling Screen (SOGS).","Esparza-Reig J, et al.","Psicothema. 2021."
"Impulsivity, alexithymia and dissociation among pathological gamblers in different therapeutic settings: A multisample comparison study.","Gori A, et al.","Psychiatry Res. 2016."
"Betting on Illusory Patterns: Probability Matching in Habitual Gamblers.","Gaissmaier W, et al.","J Gambl Stud. 2016."
"Examination of proposed DSM-5 changes to pathological gambling in a helpline sample.","Weinstock J, et al.","J Clin Psychol. 2013."
"Psychopathology of addiction: Can the SCL90-based five-dimensional structure differentiate Heroin Use Disorder from a non-substance-related addictive disorder such as Gambling Disorder?","Maremmani AGI, et al.","Ann Gen Psychiatry. 2018."
"Sensation seeking in a community sample of French gamblers: Comparison between strategic and non-strategic gamblers.","Bonnaire C, et al.","Psychiatry Res. 2017."
"Psychometric properties of the Barratt Impulsiveness Scale in patients with gambling disorders, hypersexuality, and methamphetamine dependence.","Reid RC, et al.","Addict Behav. 2014."
"Gambling in patients with major depressive disorder is associated with an elevated risk of Suicide: Insights from 12-years of Nationwide inpatient sample data.","Jolly T, et al.","Addict Behav. 2021."
"[The new types of addiction].","Semaille P.","Rev Med Brux. 2009."
"Development of Gambling Behaviour and Its Relationship with Perceived Social Support: A Longitudinal Study of Young Adult Male Gamblers.","Bickl AM, et al.","J Gambl Stud. 2023."
"Responsible Gambling Telephone Intervention to High-Risk Gamblers by a State-Owned Gambling Operator in Sweden: Study Protocol for a Study on Effectiveness, User Satisfaction, and Acceptability.","Håkansson A, et al.","Int J Environ Res Public Health. 2020."
"The role of affect-driven impulsivity in gambling cognitions: A convenience-sample study with a Spanish version of the Gambling-Related Cognitions Scale.","Del Prete F, et al.","J Behav Addict. 2017."
"Exploring the Occurrence and Procedure of Addiction in Sports Lottery: A Case Study.","Shi W, et al.","Am J Health Behav. 2022."
"Dopamine D₁ receptors and nonlinear probability weighting in risky choice.","Takahashi H, et al.","J Neurosci. 2010."
"Is there such a thing as gambling dual disorder? Preliminary evidence and clinical profiles.","Szerman N, et al.","Eur Neuropsychopharmacol. 2023."
"Increased risk for developing gambling disorder under the treatment with pramipexole, ropinirole, and aripiprazole: A nationwide register study in Sweden.","Wolfschlag M, et al.","PLoS One. 2021."
"Internet-based cognitive behavior therapy for problem gambling in routine care: protocol for a non-randomized pilot and feasibility trial.","Molander O, et al.","Pilot Feasibility Stud. 2020."
"Heart rate variability and interoceptive accuracy predict impaired decision-making in Gambling Disorder.","Moccia L, et al.","J Behav Addict. 2021."
"Initial validation of a transdiagnostic compulsivity questionnaire: the Cambridge-Chicago Compulsivity Trait Scale.","Chamberlain SR, et al.","CNS Spectr. 2018."
"""It's the Attraction of Winning That Draws You in""-A Qualitative Investigation of Reasons and Facilitators for Videogame Loot Box Engagement in UK Gamers.","Nicklin LL, et al.","J Clin Med. 2021."
"Neuroimaging of reward mechanisms in Gambling disorder: an integrative review.","Clark L, et al.","Mol Psychiatry. 2019."
"Diagnostic Criteria for Problematic Internet Use among U.S. University Students: A Mixed-Methods Evaluation.","Li W, et al.","PLoS One. 2016."
"Expanding the definition of addiction: DSM-5 vs. ICD-11.","Grant JE, et al.","CNS Spectr. 2016."
"The Role of Prospection in Steep Temporal Reward Discounting in Gambling Addiction.","Wiehler A, et al.","Front Psychiatry. 2015."
"Linking empathy to visuospatial perspective-taking in gambling addiction.","Tomei A, et al.","Psychiatry Res. 2017."
"Culture and age influences upon gambling and problem gambling.","Subramaniam M, et al.","Addict Behav Rep. 2015."
"Neuroscience in gambling policy and treatment: an interdisciplinary perspective.","Yücel M, et al.","Lancet Psychiatry. 2017."
"""Wanting,"" ""liking,"" and their relation to consciousness.","Anselme P, et al.","J Exp Psychol Anim Learn Cogn. 2016."
"Predictors of pathological gambling severity taking gender differences into account.","González-Ortega I, et al.","Eur Addict Res. 2013."
"Does size matter? An examination of problem gamblers' skin conductance responses to large and small magnitude rewards.","Lole L, et al.","Psychophysiology. 2017."
"Damage to insula abolishes cognitive distortions during simulated gambling.","Clark L, et al.","Proc Natl Acad Sci U S A. 2014."
"Validating the gambling functional assessment--revised in a United kingdom sample.","Weatherly JN, et al.","J Gambl Stud. 2014."
"Materialism, Financial Motives and Gambling: Examination of an Unexplored Relationship.","Eyzop E, et al.","J Gambl Stud. 2019."
"Pathological Gambling Associated With Aripiprazole or Dopamine Replacement Therapy: Do Patients Share the Same Features? A Review.","Grall-Bronnec M, et al.","J Clin Psychopharmacol. 2016."
"Brain Network Underlying Executive Functions in Gambling and Alcohol Use Disorders: An Activation Likelihood Estimation Meta-Analysis of fMRI Studies.","Quaglieri A, et al.","Brain Sci. 2020."
"A latent class analysis of DSM-IV pathological gambling criteria in a nationally representative British sample.","McBride O, et al.","Psychiatry Res. 2010."
"Co-occurring Disordered Gambling Among Treatment-Seekers at a Community Outpatient Addiction Clinic.","Elman I, et al.","J Addict Med. 2016."
"A Comparison of Online Versus Offline Gambling Harm in Portuguese Pathological Gamblers: An Empirical Study.","Hubert P, et al.","Int J Ment Health Addict. 2018."
"Pathological Gambling in Parkinson's disease: Autonomic measures supporting impaired decision-making.","Angioletti L, et al.","Eur J Neurosci. 2019."
"Current suicidal ideation in treatment-seeking individuals in the United Kingdom with gambling problems.","Ronzitti S, et al.","Addict Behav. 2017."
"Attentional bias in non-problem gamblers, problem gamblers, and abstinent pathological gamblers: An experimental study.","Ciccarelli M, et al.","J Affect Disord. 2016."
"The association between gambling pathology and personality disorders.","Sacco P, et al.","J Psychiatr Res. 2008."
"Obsessive-compulsive, harm-avoidance and persistence tendencies in patients with gambling, gaming, compulsive sexual behavior and compulsive buying-shopping disorders/concerns.","Mestre-Bach G, et al.","Addict Behav. 2023."
"Co-occurrence of alcohol use disorder and behavioral addictions: relevance of impulsivity and craving.","Di Nicola M, et al.","Drug Alcohol Depend. 2015."
"Individual strategies in the rat gambling task are related to voluntary alcohol intake, but not sexual behavior, and can be modulated by naltrexone.","Tjernström N, et al.","Front Psychiatry. 2022."
"Delay Discounting in Gambling Disorder: Implications in Treatment Outcome.","Mena-Moreno T, et al.","J Clin Med. 2022."
"A Case-Control Study on Behavioral Addictions and Neurocognition: Description of the BANCO and BANCO2 Protocols.","Hurel E, et al.","Neuropsychiatr Dis Treat. 2021."
"Gambling and COVID-19: Initial Findings from a UK Sample.","Sharman S, et al.","Int J Ment Health Addict. 2022."
"Getting a grip on problem gambling: what can neuroscience tell us?","Goudriaan AE, et al.","Front Behav Neurosci. 2014."
"Using the Risk-Return Model to Explain Gambling Disorder Symptoms in Youth: An Empirical Investigation with Italian Adolescents.","Donati MA, et al.","J Gambl Stud. 2021."
"Non-invasive brain stimulation targets and approaches to modulate gambling-related decisions: A systematic review.","Pettorruso M, et al.","Addict Behav. 2021."
"Designing and Evaluating the Validity and Reliability of the Persian Gambling Disorder Screening Questionnaire.","Maarefvand M, et al.","Addict Health. 2019."
"Understanding gambling in the United Kingdom: A qualitative study on the experiences of gamblers' families.","Azemi F, et al.","Front Psychol. 2023."
"Substance and Behavioral Addictions among American Indian and Alaska Native Populations.","Soto C, et al.","Int J Environ Res Public Health. 2022."
"Understanding Online Voluntary Self-Exclusion in Gambling: An Empirical Study Using Account-Based Behavioral Tracking Data.","Catania M, et al.","Int J Environ Res Public Health. 2021."
"The Janus-Faced Role of Gambling Flow in Addiction Issues.","Trivedi RH, et al.","Cyberpsychol Behav Soc Netw. 2017."
"Experience of LGBTQIA2S+ populations with gambling during the COVID-19 pandemic: protocol for a mixed-methods study.","Brodeur M, et al.","BMJ Open. 2023."
"Measuring treatment outcomes in gambling disorders: a systematic review.","Pickering D, et al.","Addiction. 2018."
"A cross-cultural study of gambling disorder: a comparison between women from Brazil and the United States.","Medeiros GC, et al.","Braz J Psychiatry. 2016."
"Exploring the Gaps in Programming for Men and Women with a Gambling Disorder in the Correctional System in Canada.","Jindani F, et al.","Int J Offender Ther Comp Criminol. 2022."
"What is in a name? Is food addiction a misnomer?","Vella SL, et al.","Asian J Psychiatr. 2017."
"Self-reported gambling problems and digital traces.","Phillips JG, et al.","Cyberpsychol Behav Soc Netw. 2014."
"Emergent response allocation and outcome ratings in slot machine gambling.","Dymond S, et al.","Psychol Addict Behav. 2012."
"[Detecting and Treating Comorbid Disorders in First-Episode Psychosis: A Lever for Recovery].","Corbeil O, et al.","Sante Ment Que. 2021."
"Assessment of Criteria for Specific Internet-use Disorders (ACSID-11): Introduction of a new screening instrument capturing ICD-11 criteria for gaming disorder and other potential Internet-use disorders.","Müller SM, et al.","J Behav Addict. 2022."
"[Problematic gambling and criminal responsibility].","Gorsane MA, et al.","Encephale. 2021."
"Congruence couple therapy for alcohol use and gambling disorders with comorbidities (part I): Outcomes from a randomized controlled trial.","Lee BK, et al.","Fam Process. 2023."
"A Within-Subject Pilot Feasibility Study of a Gambling Specific SBIRT Intervention Delivered in an Urban HIV/Primary Clinic.","Heinlein E, et al.","J Gambl Stud. 2022."
"Pre-clinical models of reward deficiency syndrome: A behavioral octopus.","Gondré-Lewis MC, et al.","Neurosci Biobehav Rev. 2020."
"Problem gambling and gaming in elite athletes.","Håkansson A, et al.","Addict Behav Rep. 2018."
"Naltrexone: A Pan-Addiction Treatment?","Aboujaoude E, et al.","CNS Drugs. 2016."
"Nicotine dependence and psychiatric and substance use comorbidities in a sample of American Indian male veterans.","Dickerson DL, et al.","Drug Alcohol Depend. 2009."
"Neuropsychological characteristics and personality traits in pathological gambling.","Forbush KT, et al.","CNS Spectr. 2008."
"Familial influences on gambling behavior: an analysis of 3359 twin pairs.","Eisen SA, et al.","Addiction. 1998."
"Engineered highs: Reward variability and frequency as potential prerequisites of behavioural addiction.","Clark L, et al.","Addict Behav. 2023."
"Client Views of Contingency Management in Gambling Treatment: A Thematic Analysis.","Dorey L, et al.","Int J Environ Res Public Health. 2022."
"Derived transformation of children's pregambling game playing.","Dymond S, et al.","J Exp Anal Behav. 2010."
"The proxy effect: gender and gambling problem trajectories of iowa gambling treatment program participants.","Nelson SE, et al.","J Gambl Stud. 2006."
"Individual differences and predictors of general awareness in problem gambling.","Gooding NB, et al.","Addict Behav. 2023."
"Is gambling disorder associated with impulsivity traits measured by the UPPS-P and is this association moderated by sex and age?","Savvidou LG, et al.","Compr Psychiatry. 2017."
"Predictors of Outcome among Pathological Gamblers Receiving Cognitive Behavioral Group Therapy.","Jiménez-Murcia S, et al.","Eur Addict Res. 2015."
"Gambling behavior of Louisiana students in grades 6 through 12.","Westphal JR, et al.","Psychiatr Serv. 2000."
"A Descriptive Study of Gambling Among Emerging Adult Males in French-Speaking Switzerland.","Tomei A, et al.","J Gambl Stud. 2015."
"Tilt in Online Poker: Loss of Control and Gambling Disorder.","Moreau A, et al.","Int J Environ Res Public Health. 2020."
"Problematic Gaming and Internet Use but Not Gambling May Be Overrepresented in Sexual Minorities - A Pilot Population Web Survey Study.","Broman N, et al.","Front Psychol. 2018."
"Personality biomarkers of pathological gambling: A machine learning study.","Cerasa A, et al.","J Neurosci Methods. 2018."
"Impulsivity, implicit attitudes and explicit cognitions, and alcohol dependence as predictors of pathological gambling.","Flórez G, et al.","Psychiatry Res. 2016."
"No Significant Changes in Addictive and Problematic Behaviors During the COVID-19 Pandemic and Related Lockdowns: A Three-Wave Longitudinal Study.","Koós M, et al.","Front Psychol. 2022."
"Reliability assessment of temporal discounting measures in virtual reality environments.","Bruder LR, et al.","Sci Rep. 2021."
"Cognitive Remediation Interventions for Gambling Disorder: A Systematic Review.","Challet-Bouju G, et al.","Front Psychol. 2017."
"18-Item Version of the Short Gambling Harm Screen (SGHS-18): Validation of Screen for Assessing Gambling-Related Harm among Finnish Population.","Latvala T, et al.","Int J Environ Res Public Health. 2021."
"""Death drive"" scientifically reconsidered: Not a drive but a collection of trauma-induced auto-addictive diseases.","Kirsch M, et al.","Front Psychol. 2022."
"Impulse control and related disorders in Parkinson's disease.","Vargas AP, et al.","Arq Neuropsiquiatr. 2018."
"Why do young adults gamble online? A qualitative study of motivations to transition from social casino games to online gambling.","Kim HS, et al.","Asian J Gambl Issues Public Health. 2017."
"Late life gambling: the attitudes and behaviors of older adults.","McNeilly DP, et al.","J Gambl Stud. 2000."
"Usefulness and validity of the modified Addiction Severity Index: A focus on alcohol, drugs, tobacco, and gambling.","Denis C, et al.","Subst Abus. 2016."
"Target identification and validation in brain reward dysfunction.","Alguacil LF, et al.","Drug Discov Today. 2015."
"The Economic Burden of Pathological Gambling and Co-occurring Mental Health and Substance Use Disorders.","Rodriguez-Monguio R, et al.","J Addict Med. 2018."
"The stock market as a casino: Associations between stock market trading frequency and problem gambling.","Mosenhauer M, et al.","J Behav Addict. 2021."
"Association between religiosity or spirituality and internet addiction: A systematic review.","Dossi F, et al.","Front Public Health. 2022."
"[Increase in the level of orexin receptor 1 (OX1R) mRNA in the brain structures of rats prone to impulsivity in behavior].","Sekste EA, et al.","Biomed Khim. 2021."
"Development of a gambling addictive behavior scale for adolescents in Korea.","Park HS, et al.","J Korean Acad Nurs. 2012."
"Exploring the Precipitating Events and Gambling-Related Activities that Prompt Problem Gamblers and Spouses/Cohabitants to Contact a Gambling Helpline.","Sciola A, et al.","J Gambl Stud. 2023."
"Internet-Based Delivery of Cognitive Behaviour Therapy Compared to Monitoring, Feedback and Support for Problem Gambling: A Randomised Controlled Trial.","Casey LM, et al.","J Gambl Stud. 2017."
"Development and validation of the Gambling Follow-up Scale, Self-Report version: an outcome measure in the treatment of pathological gambling.","Galetti AM, et al.","Braz J Psychiatry. 2017."
"Punding in non-demented Parkinson's disease patients: Relationship with psychiatric and addiction spectrum comorbidity.","Pettorruso M, et al.","J Neurol Sci. 2016."
"Debate: Behavioural addictions and technology use - risk and policy recommendations for problematic online gambling and gaming.","Kuss D, et al.","Child Adolesc Ment Health. 2021."
"Do the Consequences Experienced by the People in the Life of a Problem Gambler Differ Based on the Nature of Their Relationship with the Gambler?","Ferland F, et al.","J Gambl Stud. 2022."
"Pharmacological evidence of a cholinergic contribution to elevated impulsivity and risky decision-making caused by adding win-paired cues to a rat gambling task.","Betts GD, et al.","J Psychopharmacol. 2021."
"Are Comorbid Disorders Associated with Changes in Gambling Activity? A Longitudinal Study of Younger and Older Subjects with DSM-IV Pathological Gambling.","Black DW, et al.","J Gambl Stud. 2021."
"Shared microstructural features of behavioral and substance addictions revealed in areas of crossing fibers.","Yip SW, et al.","Biol Psychiatry Cogn Neurosci Neuroimaging. 2017."
"Intergenerational Childhood Maltreatment in Persons with DSM-IV Pathological Gambling and Their First-Degree Relatives.","Shultz SK, et al.","J Gambl Stud. 2016."
"Comfort for uncertainty in pathological gamblers: a fMRI study.","Brevers D, et al.","Behav Brain Res. 2015."
