"Title","PMID"
"Phenomenological analysis of maladaptive daydreaming associated with internet gaming addiction: a case report.","33782659"
"Role of Gambling in Payback Failure in Consumer Credit-Data from a Large Body of Material Regarding Consumer Loan Recipients in Sweden.","32340111"
"Internet Gaming Disorder in Adolescents With Psychiatric Disorder: Two Case Reports Using a Developmental Framework.","31133904"
"[Computer game addiction: a psychopathological symptom complex in adolescence].","18027346"
"Pathological gambling and switching addictions: Report of a case.","24234785"
"[Telephone Counseling for Pathological Gamblers as Immediate Access to the Health Care System: Acceptance and Use of The Mainzer Behavioral Addiction Helpline].","29758572"
"Effect of physical therapy management of nonspecific low back pain with exercise addiction behaviors: A case series.","29111859"
"[Alternating addictions: apropos of 3 cases].","9035985"
"To Binge Watch TV Series: How a Leisure Activity May Affect Sleep, Mood and Quality of Life.","37416055"
"[The course of training mania depending on its development and anabolic steroids abuse].","18379475"
"Mobile phone use and its threat to dependence among secondary school students - an explanatory study.","37387381"
"Personality profiles of substance and behavioral addictions.","29547799"
"Is exercise addiction in fitness centers a socially accepted behavior?","29450243"
"Which dimensions of impulsivity are related to problematic practice of physical exercise?","28494647"
"Addiction and Engagement: An Explorative Study Toward Classification Criteria for Internet Gaming Disorder.","26075922"
"Excessive indoor tanning as a behavioral addiction: a literature review.","24001299"
"Exercise dependence among customers from a Parisian sport shop.","26166828"
"Decreased functional connectivity in an executive control network is related to impaired executive function in Internet gaming disorder.","25445475"
"Brains online: structural and functional correlates of habitual Internet use.","24612094"
"Internet Addiction in adolescence: Neurobiological, psychosocial and clinical issues.","28027952"
"Cell-Phone Addiction: A Review.","27822187"
"Needle Fixation Profile: An Exploratory Assessment of Applicability in the Australian Context.","26549690"
"Yohimbine-induced amygdala activation in pathological gamblers: a pilot study.","22319607"
"Similar hyporesponsiveness of the dorsomedial prefrontal cortex in problem gamblers and heavy smokers during an inhibitory control task.","21893386"
"Substance abuse treatment and psychiatric comorbidity: do benefits spill over? Analysis of data from a prospective trial among cocaine-dependent homeless persons.","16965639"
"The influence of Facebook intrusion and task context on cognitive control.","35274158"
"Mapping Internet gaming disorder using effective connectivity: A spectral dynamic causal modeling study.","30366150"
"Exploring experiences of binge-watching and perceived addictiveness among binge-watchers: a qualitative study.","36474226"
"Factors associated with Facebook addiction among university students amid the COVID-19 pandemic: Findings from an online cross-sectional survey.","36006977"
"Understanding exercise addiction, psychiatric characteristics and use of anabolic androgenic steroids among recreational athletes - An online survey study.","35979064"
"Telehealth treatment for gambling disorder in the COVID-19 era: seismic shifts and silver linings.","35781466"
"Gambling Disorder as an Addictive Disorder and Creative Psychopharmacotherapy.","35354178"
"Tecnotest: A screening tool for technological addictions and gambling disorder.","34882236"
"Reading Motivation, Alcohol and Drug Use in Future Teachers in Preschool and Primary School.","34542441"
"Comparing public perceptions of substance addictions and behavioural addictions.","33487493"
"Sexual addiction 25 years on: A systematic and methodological review of empirical literature and an agenda for future research.","33038740"
"The Social Media Disorder and Ostracism in Adolescents: (OSTRACA- SM Study).","32612421"
"Stress responding and stress-related changes in cue reactivity in heavy smokers, problem gamblers, and healthy controls.","30421575"
"Evidence for a differential visual M300 brain response in gamblers.","30216906"
"Facebook Addiction: Onset Predictors.","29882872"
"Transcranial Direct Current Stimulation in Substance Use Disorders: A Systematic Review of Scientific Literature.","28272095"
"The assessment of orthorexia nervosa among 1899 Polish adolescents using the ORTO-15 questionnaire.","27314473"
"Transcranial direct current stimulation (tDCS) in behavioral and food addiction: a systematic review of efficacy, technical, and methodological issues.","26500478"
"Brain Imaging in Gambling Disorder.","26273544"
"Muscle dysmorphia: could it be classified as an addiction to body image?","25592218"
"Neurobiological risk factors for problematic social media use as a specific form of Internet addiction: A narrative review.","37303928"
"Deconstructing the components model of addiction: an illustration through ""addictive"" use of social media.","36940658"
"Web-based Evidence on the Treatment of Behavioral Addictions in United States Model Treatment Centers.","36189854"
"Anxiety-Depressive Syndrome and Binge-Watching Among Young Adults.","34335407"
"Neural correlates of response inhibition and performance monitoring in binge watching.","32976889"
"A positive shift in resting-state functional connectivity between the insula and default mode network regions reflects the duration of illness in gambling disorder patients without lifetime substance abuse.","31770702"
"Differences in Emotion Regulation Considering Gender, Age, and Gambling Preferences in a Sample of Gambling Disorder Patients.","31572231"
"Assessment of the Italian Version of the Internet Disorder Scale (IDS-15).","29904328"
"Balancing between prejudice and fact for Gaming Disorder: Does the existence of alcohol use disorder stigmatize healthy drinkers or impede scientific research?","28816518"
"The relationship between study addiction and work addiction: A cross-cultural longitudinal study.","27842448"
"Conceptualizing Internet use disorders: Addiction or coping process?","27278653"
"Blunted feedback processing during risk-taking in adolescents with features of problematic Internet use.","25679363"
"Temporal associations between morningness/eveningness, problematic social media use, psychological distress and daytime sleepiness: Mediated roles of sleep quality and insomnia among young adults.","32406567"
"Frontal cortex gray matter volume alterations in pathological gambling occur independently from substance use disorder.","26771165"
"Serotonin function in pathological gambling: blunted growth hormone response to sumatriptan.","19825906"
"Risk and protective factors of Internet gaming disorder among Chinese people: A meta-analysis.","34250835"
"Loneliness and the Degree of Addiction to Shopping and Work among Polish Women: The Mediating Role of Depression.","36362516"
"Personality traits and their role as risk modifiers in gaming disorder and internet use disorders.","36170176"
"Substance use disorders during the COVID-19 pandemic: looking for new innovative approaches.","35315387"
"Neurophysiological Markers of Internet Gaming Disorder: A Literature Review of Electroencephalography Studies.","34660067"
"Response inhibition in problematic social network sites use: an ERP study.","33674995"
"Neurobiological influence of comorbid conditions in young patients diagnosed with gaming disorder: A whole-brain functional connectivity study based on a data driven method.","32469991"
"Neural correlates of cue- and stress-induced craving in gambling disorders: implications for transcranial magnetic stimulation interventions.","30575160"
"Dysfunctional reward circuitry in obsessive-compulsive disorder.","21272861"
"Increased risk for developing gambling disorder under the treatment with pramipexole, ropinirole, and aripiprazole: A nationwide register study in Sweden.","34061895"
"A descriptive survey of online gaming characteristics and gaming disorder in Ireland.","32106893"
"Generalised Versus Specific Internet Use-Related Addiction Problems: A Mixed Methods Study on Internet, Gaming, and Social Networking Behaviours.","30572652"
"Manifesto for a European research network into Problematic Usage of the Internet.","30509450"
"Future of mental health in the metaverse.","36189180"
"Social media use and abuse: Different profiles of users and their associations with addictive behaviours.","36748081"
"Internet Gaming Disorder in Children and Adolescents with Attention Deficit Hyperactivity Disorder.","35327800"
"Improvement of Impulsivity and Decision Making by Transcranial Direct Current Stimulation of the Dorsolateral Prefrontal Cortex in a Patient with Gambling Disorder.","34213750"
"Development and Psychometric Assessment of the Problematic QQ Use Scale among Adolescents.","34201555"
"Addictive behaviors across the menstrual cycle: a systematic review.","33404701"
"Smartphone addiction and its complications related to health and daily activities among university students in Saudi Arabia: A multicenter study.","33102273"
"Gender Differences in Problem Gamblers in an Online Gambling Setting.","32884371"
"The Hotel Room Purchase Task: Effects of Gender and Partner Desirability on Demand for Hypothetical Sex in Individuals with Disordered Cocaine Use and Controls.","31989411"
"Mobile Phone Addiction Among Children and Adolescents: A Systematic Review.","31800517"
"Negative and positive life events and their relation to substance and behavioral addictions.","31563094"
"Intensive online videogame involvement: A new global idiom of wellness and distress.","31084279"
"Problematic Gaming and Internet Use but Not Gambling May Be Overrepresented in Sexual Minorities - A Pilot Population Web Survey Study.","30483191"
"Can neuroimmune mechanisms explain the link between ultraviolet light (UV) exposure and addictive behavior?","30009997"
"Internet Gaming Disorder: An Emergent Health Issue for Men.","29606034"
"A Tripartite Neurocognitive Model of Internet Gaming Disorder.","29312016"
"Now you see it, Now you don't: compulsive exercise in adolescents with an eating disorder.","28392917"
"Common and differential brain abnormalities in gambling disorder subtypes based on risk attitude.","28131932"
"Characteristics of self-identified sexual addicts in a behavioral addiction outpatient clinic.","27774812"
"Smartphone use can be addictive? A case report.","27599674"
"Neurophysiological features of Internet gaming disorder and alcohol use disorder: a resting-state EEG study.","26327686"
"Dyskinesias and impulse control disorders in Parkinson's disease: From pathogenesis to potential therapeutic approaches.","26216865"
"The influence of impulsiveness on binge eating and problem gambling: A prospective study of gender differences in Canadian adults.","25961146"
"Altered resting-state functional connectivity of the insula in young adults with Internet gaming disorder.","25899520"
"Altered paralimbic interaction in behavioral addiction.","23487797"
"Internet and gaming addiction: a systematic literature review of neuroimaging studies.","24961198"
"Extensive abnormality of brain white matter integrity in pathological gambling.","22079653"
"Research trends related to problematic smartphone use among school-age children including parental factors: a text network analysis.","37170491"
"The relationship between problematic Instagram use and eating disorders psychopathology: an explanatory structural equation model.","37022359"
"Online dialectical behavioral therapy for adults with internet addiction: A quasi-experimental trial during the COVID-19 pandemic.","35792416"
"An addictive disorders severity model: a chained mediation analysis using structural equation modeling.","35616192"
"Parental Acceptance/Rejection Perceptions and Attachment Styles of Men With Online Gambling Disorder.","34731391"
"Problematic Use of the Internet in Subjects With Bipolar Disorder: Relationship With Posttraumatic Stress Symptoms.","33981258"
"Problematic Social-Networks-Use in German Children and Adolescents-The Interaction of Need to Belong, Online Self-Regulative Competences, and Age.","32272612"
"Mobile Phone Use and Mental Health. A Review of the Research That Takes a Psychological Perspective on Exposure.","30501032"
"Dopamine synthesis capacity correlates with µ-opioid receptor availability in the human basal ganglia: A triple-tracer PET study.","30077742"
"Dopaminergic Drug Effects on Probability Weighting during Risky Decision Making.","29632870"
"Characteristics of Social Network Gamers: Results of an Online Survey.","26217238"
"Food addiction in the light of DSM-5.","25230209"
"Decision-making deficits in patients diagnosed with disordered gambling using the Cambridge Gambling task: the effects of substance use disorder comorbidity.","25161815"
"Pathological gambling and alcohol dependence: neural disturbances in reward and loss avoidance processing.","24754423"
"Excessive Internet gaming and decision making: do excessive World of Warcraft players have problems in decision making under risky conditions?","21641048"
"University Students' Gaming and Gambling Behaviors, Related Factors, and the Relationship Between Gaming and Gambling.","37115422"
"Predicting the Learning Avoidance Motivation, Learning Commitment, and Silent Classroom Behavior of Chinese Vocational College Students Caused by Short Video Addiction.","37046912"
"Parents Rate Problematic Video Streaming in Adolescents: Conceptualization and External Assessment of a New Clinical Phenomenon Based on the ICD-11 Criteria of Gaming Disorder.","36769663"
"Correlations between Problematic Mobile Phone Use and Depressiveness and Daytime Sleepiness, as Well as Perceived Social Support in Adolescents.","36294125"
"Approach-Avoidance pattern of attentional bias in individuals with high tendencies toward problematic Internet pornography use.","36159913"
"The validity of qualtrics panel data for research on video gaming and gaming disorder.","35511535"
"Eating disorder in gambling disorder: A group with increased psychopathology.","34587116"
"Self-Exclusion from Gambling-A Measure of COVID-19 Impact on Gambling in a Highly Online-Based Gambling Market?","34299817"
"Problematic internet gaming in adolescents, and its relationship with emotional regulation and perceived social support.","33412424"
"The problematic use of mobile phone and mental health: A review study in Iran.","33282995"
"Facebook Role Play Addiction - A Comorbidity with Multiple Compulsive-Impulsive Spectrum Disorders.","27156380"
"Exposure to and engagement with gambling marketing in social media: Reported impacts on moderate-risk and problem gamblers.","26828642"
"A critical review of ""Internet addiction"" criteria with suggestions for the future.","25592305"
"The ""Pathological Gambling and Epidemiology"" (PAGE) study program: design and fieldwork.","25583586"
"How the economic situation moderates the influence of available money on compulsive buying of students - A comparative study between Turkey and Greece.","25317341"
"Is love passion an addictive disorder?","20545601"
"Negative Affect and Problematic Binge-Watching: The Mediating Role of Unconstructive Ruminative Thinking Style.","36246519"
"Psychometric properties of the metacognitions about smartphone use questionnaire (MSUQ) in Chinese college students.","34359017"
"Latent profiles of family background, personality and mental health factors and their association with behavioural addictions and substance use disorders in young Swiss men.","29734129"
"The development and validation of the Addiction-like Eating Behaviour Scale.","28676680"
"Prevalence of problematic internet use in Slovenia.","27703540"
"Genome-wide association study of pathological gambling.","27315593"
"[Chemical and behavioural addiction of medical students. Comparative study in Lebanese students].","23200612"
"Effects of mu opioid receptor antagonism on cognition in obese binge-eating individuals.","22752384"
"A rise in social media use in adolescents during the COVID-19 pandemic: the French validation of the Bergen Social Media Addiction Scale in a Canadian cohort.","37004081"
"Acupuncture ameliorates Mobile Phone Addiction with sleep disorders and restores salivary metabolites rhythm.","36896350"
"Network analysis of internet addiction and sleep disturbance symptoms.","36868497"
"A spatiotemporal increase of neuronal activity accompanies the motivational effect of wheel running in mice.","35777550"
"Shoplifting Behavior Among Patients With an Eating Disorder at a Medical Correctional Center in Japan: A Cross-Sectional Study.","35664486"
"Prefrontal cortical activation in Internet Gaming Disorder Scale high scorers during actual real-time internet gaming: A preliminary study using fNIRS.","35394923"
"The Association between Symptoms of Nomophobia, Insomnia and Food Addiction among Young Adults: Findings of an Exploratory Cross-Sectional Survey.","33467561"
"Event-related potentials in a two-choice oddball task of impaired behavioral inhibitory control among males with tendencies towards cybersex addiction.","32903206"
"Testing the transdiagnostic hypothesis of inhibitory control deficits in addictions: An experimental study on gambling disorder.","32554838"
"Changes in Gambling Behavior during the COVID-19 Pandemic-A Web Survey Study in Sweden.","32516880"
"Facets of impulsivity and related aspects differentiate among recreational and unregulated use of Internet pornography.","31120316"
"Punding in non-demented Parkinson's disease patients: Relationship with psychiatric and addiction spectrum comorbidity.","26944176"
"Blunted Endogenous Opioid Release Following an Oral Amphetamine Challenge in Pathological Gamblers.","26552847"
"Addiction-related genes in gambling disorders: new insights from parallel human and pre-clinical models.","25266122"
"A neurocognitive comparison of cognitive flexibility and response inhibition in gamblers with varying degrees of clinical severity.","21426627"
"Monetary Reward Discounting, Inhibitory Control, and Trait Impulsivity in Young Adults With Internet Gaming Disorder and Nicotine Dependence.","33584390"
"Frequency of and Factors Associated with the Presence of a History of Probable Attention-Deficit Hyperactivity Disorder in a Population of Patients with Sex Addiction.","37088070"
"A descriptive pilot survey of behavioural addictions in an adolescent secondary school population in Ireland.","34057059"
"Impairments of Sociocognitive Functions in Individuals with Behavioral Addictions: A Review Article.","37308789"
"Clinical Usefulness of a Short Version of the Internet Addiction Test to Screen for Probable Internet Addiction in Adolescents with Autism Spectrum Disorder.","36901680"
"Associations Between Addictive Behaviors, Individual Characteristics, and the Use of Gambling Services Within the World of Gaming: Cross-sectional Survey Study.","35451974"
"At-risk gambling in patients with severe psychiatric illness and in community subjects matched for age and sex.","34340131"
"Narrative theory III: Evolutionary narratives addressing mating motives change discounting and tobacco valuation.","31424235"
"Impaired learning of punishments in Parkinson's disease with and without impulse control disorder.","27848033"
"Study Addiction: A Cross-Cultural Longitudinal Study Examining Temporal Stability and Predictors of Its Changes.","27156381"
"Should pathological gambling and obesity be considered addictive disorders? A factor analytic study in a nationally representative sample.","25769392"
"Role of behavioral addictions in predicting reactivity in bipolar mood disorder patients.","24971298"
"Buprenorphine therapy for opioid addiction in rural Washington: the experience of the early adopters.","22479882"
"The Association between Alexithymia and Social Media Addiction: Exploring the Role of Dysmorphic Symptoms, Symptoms Interference, and Self-Esteem, Controlling for Age and Gender.","36675813"
"Acceptance and Commitment Therapy for Destructive Experiential Avoidance (ACT-DEA): A Feasibility Study.","36554315"
"Influence of abstinence on automatic detection bias to gaming cues in individuals with Internet gaming disorder: Evidence from visual mismatch negativity.","34817871"
"Protective and Risk Factors in Exercise Addiction: A Series of Moderated Mediation Analyses.","34574631"
"An investigation of the reinforcing value of video game playing relative to concurrently available monetary alternatives.","34570526"
"Does Attentional Style Moderate the Relationship between Time Perspective and Social Network Addiction? A Cross-Sectional Study on a Sample of Social Networking Sites Users.","34501428"
"Croatian validation of the Compulsive Internet Use Scale.","33901813"
"Altered core networks of brain connectivity and personality traits in internet gaming disorder.","32592635"
"Obsessive-compulsive or addiction? Categorical diagnostic analysis of excoriation disorder compared to obsessive-compulsive disorder and gambling disorder.","31546148"
"Association of GDNF and CNTNAP2 gene variants with gambling.","31446765"
"Spanish validation of the pathological buying screener in patients with eating disorder and gambling disorder.","30932708"
"Systematic Review of Food Addiction as Measured with the Yale Food Addiction Scale: Implications for the Food Addiction Construct.","30406740"
"The Self-perception of Text-message Dependency Scale (STDS): Psychometric update based on a United States sample.","29757688"
"Shared microstructural features of behavioral and substance addictions revealed in areas of crossing fibers.","28367515"
"Exploration of Core Symptoms for the Diagnosis of Alcohol Dependence in the ICD-10.","27716976"
"Experiential Avoidance and Technological Addictions in Adolescents.","27363463"
"Increased functional connectivity between prefrontal cortex and reward system in pathological gambling.","24367675"
"The pharmacology of the endocannabinoid system: functional and structural interactions with other neurotransmitter systems and their repercussions in behavioral addiction.","18422831"
"Subtype-selective inhibition of neuronal nicotinic acetylcholine receptors by cocaine is determined by the alpha4 and beta4 subunits.","10860932"
"Exercise Dependence in Practitioners of Martial Arts and Combat Sports.","36554661"
"Social Media Addiction among Vietnam Youths: Patterns and Correlated Factors.","36361288"
"Imbalanced sensitivities to primary and secondary rewards in internet gaming disorder.","34727087"
"Workaholism Prevention in Occupational Medicine: A Systematic Review.","34281048"
"Event-related potential (ERP) measures of error processing as biomarkers of externalizing disorders: A narrative review.","34146603"
"Proposed diagnostic criteria for compulsive buying-shopping disorder: A Delphi expert consensus study.","33852420"
"Exploring the clinical profile of problematic pornography use.","32690117"
"Development and Validation Study of the Internet Overuse Screening Questionnaire.","29669406"
"Can Pornography be Addictive? An fMRI Study of Men Seeking Treatment for Problematic Pornography Use.","28409565"
"Serum BDNF levels in patients with gambling disorder are associated with the severity of gambling disorder and Iowa Gambling Task indices.","28092195"
"[Food Addiction as a new behavioral addiction].","27852970"
"Addiction severity pattern associated with adult and childhood Attention Deficit Hyperactivity Disorder (ADHD) in patients with addictions.","27842945"
"Toward quantifying the abuse liability of ultraviolet tanning: A behavioral economic approach to tanning addiction.","27400670"
"Extensive internet involvement--addiction or emerging lifestyle?","22408585"
"Decision-making and prepotent response inhibition functions in excessive internet users.","19238122"
"Exercise identity as a risk factor for exercise dependence.","23006037"
"Cognitive deficits in problematic internet use: meta-analysis of 40 studies.","30784392"
"The prediction of resilience to alcohol consumption in youths: insular and subcallosal cingulate myeloarchitecture.","33143793"
"Workaholism, sleep disorders, and potential e-learning impacts among Menoufia university staff during COVID-19 pandemic.","34847661"
"Predictors of suicide attempts in male UK gamblers seeking residential treatment.","34772503"
"Compulsive Hoarding Symptoms and the Role of Mindfulness Skills During Social Distancing for the COVID-19 Pandemic: An Exploratory Survey.","34194342"
"Putative COVID- 19 Induction of Reward Deficiency Syndrome (RDS) and Associated Behavioral Addictions with Potential Concomitant Dopamine Depletion: Is COVID-19 Social Distancing a Double Edged Sword?","32957797"
"Structural and functional correlates of smartphone addiction.","32062336"
"Prevalence and pattern of problematic internet use among engineering students from different colleges in India.","31896863"
"[Internet-related disorders-old and new challenges. Conference report on the 10th symposium of the German Association on Internet-Related Disorders].","30859251"
"Mapping and conceptualizing recovery capital of recovered gamblers.","30589345"
"The Contribution of Sex, Personality Traits, Age of Onset and Disorder Duration to Behavioral Addictions.","30386263"
"Striatal presynaptic dopaminergic dysfunction in gambling disorder: A 123 I-FP-CIT SPECT study.","30226290"
"Detection of Craving for Gaming in Adolescents with Internet Gaming Disorder Using Multimodal Biosignals.","29301261"
"Assessment of Semi-Structured Clinical Interview for Mobile Phone Addiction Disorder.","27437008"
"Sex addiction and gambling disorder: similarities and differences.","25459420"
