"Title","PMID"
"Gambling disorder and comorbid behavioral addictions: Demographic, clinical, and personality correlates.","31951870"
"Another failure of the latent disease model? The case of compulsive sexual behavior disorder •","36112489"
"Moving internet gaming disorder forward: A reply.","25103100"
"Reliability and Validity of the Behavioral Addiction Measure for Video Gaming.","26720761"
"Internet gaming disorder and online gambling disorder: Clinical and personality correlates.","29280393"
"Cybersex addiction in a gay man: a case report.","33393441"
"Research on factors affecting serial entrepreneurial intention: An interpretive structure model.","36389459"
"The relationship between gaming disorder and addiction requires a behavioral analysis.","28816498"
"Development and validation of a stock addiction inventory (SAI).","27471543"
"Social Exclusion, Self-Forgiveness, Mindfulness, and Internet Addiction in College Students: a Moderated Mediation Approach.","33716585"
"Evidence for GABA-A receptor dysregulation in gambling disorder: correlation with impulsivity.","27739164"
"Compulsive Buying Behavior: Clinical Comparison with Other Behavioral Addictions.","27378999"
"The prefrontal dysfunction in individuals with Internet gaming disorder: a meta-analysis of functional magnetic resonance imaging studies.","24889021"
"Work addiction: An organizational behavior as well as an addictive behavior?","30541338"
"Assessment of online compulsive buying: Psychometric properties of the Italian compulsive online shopping scale (COSS).","35149277"
"Determining Typical Smartphone Usage: What Data Do We Need?","29781716"
"Commentary on: Muscle dysmorphia: could it be classified as an addiction to body image?","25592217"
"Behavioral addictions in euthymic patients with bipolar I disorder: a comparison to controls.","25505690"
"Cue reactivity towards shopping cues in female participants.","26165767"
"Rethinking the Medicalization of Violence: The Risks of a Behavioral Addiction Model.","33404314"
"Commentary on: Are we overpathologizing everyday life? A tenable blueprint for behavioral addiction research. On the slippery slopes: The case of gambling addiction.","26551898"
"Longitudinal modifiable risk and protective factors of internet gaming disorder: A systematic review and meta-analysis.","37224007"
"[Pathological gambling and computergame-addiction. Current state of research regarding two subtypes of behavioural addiction].","20195558"
"Addiction in Extreme Sports: An Exploration of Withdrawal States in Rock Climbers.","27348554"
"Criteria for conceptualizing behavioural addiction should be informed by the underlying behavioural mechanism.","28497595"
"Impaired non-verbal emotion processing in Pathological Gamblers.","26730447"
"Perspective: Can psychedelic-assisted therapy be a promising aid in compulsive sexual behavior disorder treatment?","35334305"
"Translational and Molecular Cytoarchitectural Genetic Guided Therapy to Induce Dopamine Homeostatic Neuro-signaling in Reward Deficiency and Associated Drug and Behavioral Addiction Seeking: A 60 Year Sojourn the Future is Now.","34708222"
"Benzodiazepines: more ""behavioural"" addiction than dependence.","12669174"
"Defining tolerance in Internet Gaming disorder: Isn't it time?","27297731"
"The Relationship Between Affective and Obsessive-Compulsive Symptoms in Internet Use Disorder.","34456816"
"Compulsive sexual behaviour as a behavioural addiction: the impact of the internet and other issues.","26936832"
"Neurological soft signs in individuals with pathological gambling.","23593341"
"Rates of Alexithymia and Its Association With Smartphone Addiction Among a Sample of University Students in Egypt.","32425823"
"Serum levels of brain-derived neurotrophic factor in patients with internet use disorder.","23375675"
"An international consensus for assessing internet gaming disorder using the new DSM-5 approach.","24456155"
"Behavioral Addiction from the Asian Americans Perspective: Exploration of Public and Help-Seeking Stigma.","37115421"
"Behavioural Addiction Open Definition 2.0-using the Open Science Framework for collaborative and transparent theoretical development.","28891143"
"[Computer games in childhood and adolescence: relations to addictive behavior, ADHD, and aggression].","19739057"
"[What do we mean by addiction?].","20182678"
"Pathological Gambling in Parkinson's disease: Autonomic measures supporting impaired decision-making.","29888425"
"How to counter the ten myths about work addiction?: Three postulates for future research.","30541339"
"The Relationship between Attachment Styles and Compulsive Online Shopping: The Mediating Roles of Family Functioning Patterns.","35805821"
"Interaction of Socioeconomic Status with Risky Internet Use, Gambling and Substance Use in Adolescents from a Structurally Disadvantaged Region in Central Europe.","32635320"
"Similarities between obesity in pets and children: the addiction model.","27469280"
"Not good enough? Further comments to the wording, meaning, and the conceptualization of Internet Gaming Disorder.","28301964"
"GamReg Sweden-Protocol for a systematic cohort data collection for improved clinical knowledge in specialized gambling disorder treatment.","36172517"
"Stigma and gaming disorder: should we take a 'glass half full' or 'glass half empty' perspective?","35129241"
"Problem Gambling and Problem Gaming in Elite Athletes: a Literature Review.","34867124"
"An Analysis of the Interaction Between Intelligent Software Agents and Human Users.","30930542"
"Meditation awareness training for the treatment of workaholism: A controlled trial.","28425778"
"The pharmacological management of gambling disorder: if, when, and how.","36690348"
"Meditation Awareness Training for the Treatment of Sex Addiction: A Case Study.","27348560"
"Decreased functional connectivity of insula-based network in young adults with internet gaming disorder.","27119360"
"Internet addiction in adolescents: Development and validation of Internet Addiction Diagnostic Questionnaire (KDAI).","33662841"
"Is Internet addiction a psychopathological condition distinct from pathological gambling?","24630825"
"Smartphone Restriction and Its Effect on Subjective Withdrawal Related Scores.","30150959"
"Psychometric assessment of the craving to tan questionnaire.","25140759"
"Problem Gambling in the Fitness World-A General Population Web Survey.","32093056"
"An Integrated Approach to Addictive Behaviors: A Study on Vulnerability and Maintenance Factors.","36975391"
"Examination of the Psychometric Characteristics of the Italian Version of the Game Addiction Scale for Adolescents.","30940015"
"Neural correlates of sexual cue reactivity in individuals with and without compulsive sexual behaviours.","25013940"
"Gender-Based Differences and Associated Factors Surrounding Excessive Smartphone Use Among Adolescents: Cross-sectional Study.","34813492"
"A factor-analytic investigation of computer 'addiction' and engagement.","12230834"
"Adult ADHD Diagnosis, Symptoms of Impulsivity, and Emotional Dysregulation in a Clinical Sample of Outpatients Consulting for a Behavioral Addiction.","36945199"
"Distinct Situational Cue Processing in Individuals with Kleptomania: A Preliminary Study.","36728203"
"Problematic Internet Use, Mental Health and Impulse Control in an Online Survey of Adults.","24294501"
"First evaluation of the Behavioral Addiction Indoor Tanning Screener (BAITS) in a nationwide representative sample.","28804871"
"Neural correlates of problematic gaming in adolescents: A systematic review of structural and functional magnetic resonance imaging studies.","34496459"
"Dorsal and ventral striatum activity in individuals with buying-shopping disorder during cue-exposure: A functional magnetic resonance imaging study.","34156751"
"Beyond the myths about work addiction: Toward a consensus on definition and trajectories for future studies on problematic overworking.","30920291"
"Response Inhibition and Internet Gaming Disorder: A Meta-analysis.","28264786"
"Commentary on Lewczuk et al : Moral incongruence, disapproval and behavioral 'addiction'.","33314391"
"Addicted to compulsion: assessing three core dimensions of addiction across obsessive-compulsive disorder and gambling disorder.","31106718"
"Distinct motivations to seek out information in healthy individuals and problem gamblers.","34312367"
"Ten myths and twenty years: What we know and what we still do not know about work addiction.","30541337"
"Match-Fixing Causing Harm to Athletes on a COVID-19-Influenced Gambling Market: A Call for Research During the Pandemic and Beyond.","34621216"
"Anhedonia in obsessive-compulsive disorder: beyond comorbid depression.","24564999"
"Giving a Voice to Gambling Addiction: Analysis of Personal Narratives.","31290062"
"How Different Gaming Genres Can Be Described by Required Skills and Motives for Playing.","36067114"
"Development and Validation of the Digital Life Balance (DLB) Scale: A Brand-New Measure for Both Harmonic and Disharmonic Use of ICTs.","36546972"
"Commentary on: Are we overpathologizing everyday life? A tenable blueprint for behavioral addiction research. On functional and compulsive aspects of reinforcement pathologies.","26551899"
"Treatment with the Self-Discovery Camp (SDiC) improves Internet gaming disorder.","27321966"
"Striatal dopamine D₂/D₃ receptor binding in pathological gambling is correlated with mood-related impulsivity.","22776462"
"Prevalence and construct validity of compulsive buying disorder in shopping mall visitors.","26027442"
"Clinical and Research Implications of Gambling Disorder in DSM-5.","26885470"
"Disorders Related to Use of Psychoactive Substances in DSM-5: Changes and Challenges.","26702188"
"Tolerance and withdrawal symptoms may not be helpful to enhance understanding of behavioural addictions.","27095413"
"Cryptocurrency Trading as a Behavioral Addiction: A Case Report.","37060607"
"Measuring addiction to internet gaming among Indian medical students: Development and preliminary psychometric properties of a new scale.","33776273"
"Compulsive Digital Gaming: An Emerging Mental Health Disorder in Children.","30209737"
"[Analysis of Patient Characteristics in the Inpatient Treatment of Behavioural Addictions: an Exploratory Study].","35878612"
"Susceptibility to addictive behaviour in online and traditional poker playing environments.","26166827"
"Dorsal and ventral striatal functional connectivity shifts play a potential role in internet gaming disorder.","34262129"
"Impulsivity and response inhibition in alcohol dependence and problem gambling.","19727677"
"Problem and Pathological Gambling in Schizophrenia: Exploring Links with Substance Use and Impulsivity.","29453588"
"COPE.er Method: Combating Digital Addiction via Online Peer Support Groups.","30935151"
"Commentary on: Are we overpathologizing everyday life? A tenable blueprint for behavioral addiction research. The diagnostic pitfalls of surveys: If you score positive on a test of addiction, you still have a good chance not to be addicted.","26551904"
"The stock market as a casino: Associations between stock market trading frequency and problem gambling.","34587115"
"Impulsivity and Difficulties in Emotional Regulation as Predictors of Binge-Watching Behaviours.","34858225"
"Attachment style and addictions (alcohol, cigarette, waterpipe and internet) among Lebanese adolescents: a national study.","32299500"
"Online gaming addiction in children and adolescents: A review of empirical research.","26166826"
"No significant effect of frequent online sexual behaviour on Pavlovian-to-instrumental transfer (PIT): Implications for compulsive sexual behaviour disorder.","36178949"
"Enhanced attentional bias towards sexually explicit cues in individuals with and without compulsive sexual behaviours.","25153083"
"Psychometric development of the Problematic Pornography Use Scale.","24583276"
"Neural substrates of self- and external-preoccupation: A voxel-based morphometry study.","31004413"
"Identifying core transdisciplinary constructs in addiction has clinical utility.","30801833"
"Engineered highs: Reward variability and frequency as potential prerequisites of behavioural addiction.","36701907"
"The role of attention in decision-making under risk in gambling disorder: An eye-tracking study.","36444787"
"Issues raised by the DSM-5 internet gaming disorder classification and proposed diagnostic criteria.","25103097"
"Altered serum levels of brain-derived neurotrophic factor in patients with pathological gambling.","22854676"
"Stress vulnerability in male youth with Internet Gaming Disorder.","28122298"
"The Behavioral Addiction Indoor Tanning Screener (BAITS): An Evaluation of a Brief Measure of Behavioral Addictive Symptoms.","26568436"
"From Emotional (Dys)Regulation to Internet Addiction: A Mediation Model of Problematic Social Media Use among Italian Young Adults.","35011929"
"Are Cyberchondria and Intolerance of Uncertainty Related to Smartphone Addiction?","37363761"
"Network Analysis of Internet Addiction Symptoms Among a Clinical Sample of Japanese Adolescents with Autism Spectrum Disorder.","33040268"
"An A-B-C model of habit disorders: hair-pulling, skin-picking, and other stereotypic conditions.","17075554"
"The Role of Self-esteem and Fear of Negative Evaluation in Compulsive Buying.","28512435"
"The relationship between internet addiction, attention deficit hyperactivity symptoms and online activities in adults.","30176388"
"Specific cue reactivity on computer game-related cues in excessive gamers.","17592953"
"Under the influence of Facebook? Excess use of social networking sites and drinking motives, consequences, and attitudes in college students.","28092186"
"Theoretical conceptualisations of problematic exercise in psychometric assessment instruments: A systematic review.","33822749"
"Health risks and potential remedies during prolonged lockdowns for coronavirus disease 2019 (COVID-19).","32267243"
"A Comprehensive Model for Gambling Behaviors: Assessment of the Factors that can Contribute to the Vulnerability and Maintenance of Gambling Disorder.","33844125"
"Screening and assessment tools for gaming disorder: A comprehensive systematic review.","32143109"
"White matter integrity between left basal ganglia and left prefrontal cortex is compromised in gambling disorder.","27612435"
"Fortune telling addiction: Unfortunately a serious topic about a case report.","25786497"
"Case Report: Internet Gaming Disorder Associated With Pornography Use.","26339216"
"Is Dysfunctional Use of the Mobile Phone a Behavioural Addiction? Confronting Symptom-Based Versus Process-Based Approaches.","24947201"
"[Modern treatment approaches to gambling].","24988975"
"Gambling and self-reported changes in gambling during COVID-19 in web survey respondents in Denmark.","34337174"
"The concept of ""food addiction"" helps inform the understanding of overeating and obesity: Debate Consensus.","33448277"
"Endogenous cortisol levels are associated with an imbalanced striatal sensitivity to monetary versus non-monetary cues in pathological gamblers.","24723862"
"Diagnosis of hypersexual or compulsive sexual behavior can be made using ICD-10 and DSM-5 despite rejection of this diagnosis by the American Psychiatric Association.","27086656"
"Adaptation and validation of Richmond Compulsive Buying Scale in Chinese population.","30264602"
"The Potential Role of the Early Maladaptive Schema in Behavioral Addictions Among Late Adolescents and Young Adults.","32038394"
"Markers of Prenatal Androgen Exposure Correlate With Online Sexual Compulsivity and Erectile Function in Young Men.","33889090"
"Gaming Increases Craving to Gaming-Related Stimuli in Individuals With Internet Gaming Disorder.","29560926"
"Development of Nomophobia Profiles in Education Students through the Use of Multiple Correspondence Analysis.","33182223"
"[Caring systems for parents in the adolescent behavioural addictions].","30869298"
"The use of online methodologies in studying paraphilias - A review.","26165601"
"Should compulsive sexual behavior (CSB) be considered as a behavioral addiction? A debate paper presenting the opposing view.","32997646"
"Impact of COVID-19 on Online Gambling - A General Population Survey During the Pandemic.","33101137"
"Diagnostic and Classification Considerations Regarding Gaming Disorder: Neurocognitive and Neurobiological Features.","31258494"
"Pareto distributions in online casino gambling: Sensitivity to timeframe and associations with self exclusion.","34004521"
"Voluntary Wheel Running Induces Exercise-Seeking Behavior in Male Rats: A Behavioral Study.","29664313"
"Commentary: Worshipping the internet - the perils of serving an unpredictable master - a commentary on Aboujaoude and Gega (2021).","34490715"
"Problem Gambling in Greece: Prevalence and Risk Factors During the Financial Crisis.","31165324"
"Why is it difficult but necessary to treat behavioral addiction early on?","33222631"
"The psychometric evaluation of the Revised Exercise Addiction Inventory: Improved psychometric properties by changing item response rating.","30920295"
"Gambling disorder duration and cognitive behavioural therapy outcome considering gambling preference and sex.","36638624"
"Adaptation and Validation of the Polish Version of the 10-Item Mobile Phone Problematic Use Scale.","32581858"
"Abrupt nicotine reduction as an endgame policy: a randomised trial.","25398562"
"Associations of the Big Five and locus of control with problem gambling in a large Australian sample.","34125840"
"Internet gaming disorder in an adolescent during the COVID-19 pandemic: a case report.","35721634"
"Asian-americans, addictions, and barriers to treatment.","20428303"
"Longitudinal associations between maladaptive daydreaming and psychological distress during the COVID-19 health crisis.","36857029"
"Development of short-form and screening cutoff point of the Smartphone Addiction Inventory (SPAI-SF).","27658956"
"Buddhist philosophy for the treatment of problem gambling.","26165927"
"Increasing important roles of child and adolescent psychiatrists in the treatment of gaming disorder: Current status in Japan.","36339875"
"Mere Exposure: Preference Change for Novel Drinks Reflected in Human Ventral Tegmental Area.","28129051"
"'Wanting' and 'liking' skin picking: A validation of the Skin Picking Reward Scale.","26690620"
"Shared psychological characteristics that are linked to aggression between patients with Internet addiction and those with alcohol dependence.","24559036"
"Problem gamblers share deficits in impulsive decision-making with alcohol-dependent individuals.","19466924"
"Gambling, Gaming, and Internet Behavior in a Sexual Minority Perspective. A Cross-Sectional Study in Seven European Countries.","35498152"
"Comparing the Self-Report and Measured Smartphone Usage of College Students: A Pilot Study.","28326119"
"Neural fingerprints of gambling disorder using diffusion tensor imaging.","37354808"
"Factorial validity of the Problematic Facebook Use Scale for adolescents and young adults.","28198639"
"Over-connected? A qualitative exploration of the relationship between Australian youth and their mobile phones.","17560644"
"Examining bedtime procrastination, study engagement, and studyholism in undergraduate students, and their association with insomnia.","36733877"
"Recent advances in behavioral addiction treatments: focusing on mechanisms of change.","21750958"
"Dopamine genes and pathological gambling in discordant sib-pairs.","17394052"
"Classifying hypersexual disorders: compulsive, impulsive, and addictive models.","18996299"
"Commentary on: Are we overpathologizing everyday life? A tenable blueprint for behavioral addiction research.","26551895"
"Commonalities in the psychological factors associated with problem gambling and Internet dependence.","20575708"
"Alterations in the Emotional Regulation Process in Gambling Addiction: The Role of Anger and Alexithymia.","27550365"
"How is the problematic smartphone use affected by social support? A research model supported by the mediation of Ikigai.","36845209"
"Reduced loss aversion in pathological gambling and alcohol dependence is associated with differential alterations in amygdala and prefrontal functioning.","29176580"
"Internet gaming and addiction: a reply to King & Delfabbro.","24724947"
"The Prevalence of Internet Addiction Among a Japanese Adolescent Psychiatric Clinic Sample With Autism Spectrum Disorder and/or Attention-Deficit Hyperactivity Disorder: A Cross-Sectional Study.","28474226"
"Aligning the ""Manifesto for a European Research Network into Problematic Usage of the Internet"" with the Diverse Needs of the Professional and Consumer Communities Affected by Problematic Usage of Pornography.","32429206"
"Decreased functional connectivity between ventral tegmental area and nucleus accumbens in Internet gaming disorder: evidence from resting state functional magnetic resonance imaging.","26582309"
"Awareness, Self-Assessment and Help Seeking Behavior for Behavioral Addictions Related to Use of Mobile Technology Among Attendees of a Health Camp.","30341845"
"Griffiths et al.'s comments on the international consensus statement of internet gaming disorder: furthering consensus or hindering progress?","26669531"
"Commentary on: Are we overpathologizing everyday life? A tenable blueprint for behavioral addiction research. Addictions as a psychosocial and cultural construction.","26551902"
"Commentary on: Are we overpathologizing everyday life? A tenable blueprint for behavioral addiction research. Excessive behaviors are not necessarily addictive behaviors.","26551897"
"A Case of Internet Gaming Disorder: When #Play Apart Together Takes a Dark Turn.","35711876"
"A systematic review of metacognitions in Internet Gaming Disorder and problematic Internet, smartphone and social networking sites use.","33783920"
"Recorded Behavior as a Valuable Resource for Diagnostics in Mobile Phone Addiction: Evidence from Psychoinformatics.","26492275"
"Structural validation of the ORTO-12-FR questionnaire among a French sample as a first attempt to assess orthorexia nervosa in France.","31863296"
"Commentary on Schluter et al. (2018): Revisiting the core elements of addiction using a lay epidemiology approach.","29998622"
"Effects of shopping addiction on consumer decision-making: Web-based studies in real time.","26165603"
"Working memory and affective decision-making in addiction: a neurocognitive comparison between heroin addicts, pathological gamblers and healthy controls.","24268669"
"Discussing evidence on the components model of addiction. A commentary on Fournier et al. (2023).","37307757"
"A study investigating the association between compulsive buying with measures of anxiety and obsessive-compulsive behavior among internet shoppers.","25465653"
"Addiction and technology: Plus ça change plus c'est la même (The more things change, the more they remain the same).","28827875"
"Dopaminergic and clinical correlates of pathological gambling in Parkinson's disease: a case report.","23908610"
"Where the Mind Cannot Dare: A Case of Addictive Use of Online Pornography and Its Relationship With Childhood Trauma.","30015567"
"Impulsivity and compulsivity in Internet gaming disorder: A comparison with obsessive-compulsive disorder and alcohol use disorder.","29052999"
"Comparison of personality traits in pedophiles, abstinent opiate addicts, and healthy controls: considering pedophilia as an addictive behavior.","19008734"
"An Exploratory Study to Measure Excessive Involvement in Multitasking Interaction with Smart Devices.","27327067"
"[Excessive compulsive buying or ""behavioral addiction""? A case study].","15088996"
"Psychology of computer use: XLIII. Some comments on 'addictive use of the Internet' by Young.","9122355"
"Uncertainty about mapping future actions into rewards may underlie performance on multiple measures of impulsivity in behavioral addiction: evidence from Parkinson's disease.","23565936"
"The Relationship Between Childhood Trauma, Pathological Dissociation, and Behavioral Addictions in Young Adults: Findings from a Cross-Sectional Study.","36814178"
"Gatekeeper functions of general practices regarding behavioural addiction.","31558520"
"Impulsivity and cognitive distortions in pathological gamblers attending the UK National Problem Gambling Clinic: a preliminary report.","21733207"
"Implementation of the remote measuring system for addiction patients in rehabilitation applying vital sensor.","26019608"
"Increased functional connectivity in gambling disorder correlates with behavioural and emotional dysregulation: Evidence of a role for the cerebellum.","32434751"
"Acamprosate and Baclofen were Not Effective in the Treatment of Pathological Gambling: Preliminary Blind Rater Comparison Study.","21713109"
"[Diversity of obsessive-compulsive disorder and pharmacotherapy associated with obsessive-compulsive spectrum disorders].","22187889"
"The Berlin Inventory of Gambling behavior - Screening (BIG-S): Validation using a clinical sample.","28521732"
"Cell Phone Social Media Use and Psychological Well-Being in Young Adults: Implications for Internet-Related Disorders.","36673953"
"The mediator's role of communication skills in the effect of social skills on digital game addiction.","37267879"
"Altered hippocampal volume and functional connectivity in males with Internet gaming disorder comparing to those with alcohol use disorder.","28720860"
"Development of gambling disorder after bariatric surgery: a call for research.","37427279"
"The problematic internet entertainment use scale for adolescents: prevalence of problem internet use in Spanish high school students.","23253204"
"Prevalence of problematic cell phone use in an adult population in Spain as assessed by the Mobile Phone Problem Use Scale (MPPUS).","28771626"
