"PMID","Year","Month","Title","DOI","Abstract","Full_Author_Name","Author_Address","Language","Publication_Type","Journal_name_short","Conflict_of_Interest_Statement","Journal_Title"
"26733908",2015,NA,"Adventure Thrills are Addictive.","10.3389/fpsyg.2015.01915 [doi]; 1915",NA,"Buckley, Ralf C","International Chair in Ecotourism Research, Griffith School of Environment, ","eng","Journal Article","Front Psychol",NA,"Frontiers in psychology"
"26688434",2016,"Jan","Extreme binge drinking among adolescent athletes: A cause for concern?","10.1111/ajad.12323 [doi]","BACKGROUND AND OBJECTIVES: Examine the association between adolescent sport ","Veliz, Philip; McCabe, Sean Esteban; Boyd, Carol J","Institute for Research on Women and Gender, University of Michigan, Ann Arbor, ; Institute for Research on Women and Gender, University of Michigan, Ann Arbor, ; Institute for Research on Women and Gender, University of Michigan, Ann Arbor, ; Department of Psychiatry, Addiction Research Center, University of Michigan, Ann ; School of Nursing, University of Michigan, Ann Arbor, Michigan.","eng","Journal Article","Am J Addict",NA,"The American journal on addictions"
"26476004",2016,"Feb","Heterogeneity of alcohol, tobacco, and other substance use behaviors in U.S. ","S0306-4603(15)30039-3 [pii]; 10.1016/j.addbeh.2015.10.010 [doi]","PURPOSE: To identify subgroups of college students with distinct profiles of ","Evans-Polce, Rebecca; Lanza, Stephanie; Maggs, Jennifer","The Methodology Center and Prevention Research Center, Pennsylvania State ; The Methodology Center and Department of Biobehavioral Health, Pennsylvania State ; Department of Human Development and Family Studies and Prevention Research ","eng","Journal Article; Research Support, N.I.H., Extramural","Addict Behav",NA,"Addictive behaviors"
"25722076",2016,"Mar","A Case of Mistaken Identity? A Comparison of Professional and Amateur Problem ","10.1007/s10899-015-9531-4 [doi]","Professional gamblers are more likely than amateur gamblers to meet criteria for ","Hing, Nerilee; Russell, Alex M T; Gainsbury, Sally M; Blaszczynski, Alex","Centre for Gambling Education and Research, Southern Cross University, PO Box ; Centre for Gambling Education and Research, Southern Cross University, PO Box ; Centre for Gambling Education and Research, Southern Cross University, PO Box ; Gambling Treatment Clinic and Research, The University of Sydney, Sydney, NSW, ","eng","Comparative Study; Journal Article; Research Support, Non-U.S. Gov't","J Gambl Stud",NA,"Journal of gambling studies"
"24918312",2014,"Jun","Implicit motives and basic need satisfaction in extreme endurance sports.","10.1123/jsep.2013-0191 [doi]","Previous research has shown that the effects of basic psychological needs on the ","Schuler, Julia; Wegner, Mirko; Knechtle, Beat","Institute of Sport Science, University of Bern, Bern, Switzerland.","eng","Journal Article","J Sport Exerc Psychol",NA,"Journal of sport & exercise psychology"
"24803161",2014,"Jul-Aug","When and for whom are relative age effects important? Evidence from a simple test ","10.1002/ajhb.22550 [doi]","OBJECTIVES: When individuals of different ages are combined into a single group ","Veldhuizen, Scott; Wade, Terrance J; Cairney, John; Hay, John A; Faught, Brent E","Social and Epidemiological Research Department, Centre for Addictions and Mental ","eng","Journal Article; Research Support, Non-U.S. Gov't","Am J Hum Biol",NA,"American journal of human biology : the official journal of the Human Biology "
"23888586",2013,"May-Jun","[Exercise addiction].",NA,"Socially valorised, sport like other forms of behaviour, can take on an addictive ","Petit, A; Lejoyeux, M","des Universites, Praticien Hospitalier, AP-HP, H6pital Bichat, Service de ","fre","English Abstract; Journal Article; Review","Rev Med Liege",NA,"Revue medicale de Liege"
"22420455",2012,NA,"Striving for success or addiction? Exercise dependence among elite Australian ","10.1080/02640414.2012.667879 [doi]","Exercise dependence is a condition that involves a preoccupation and involvement ","McNamara, Justin; McCabe, Marita P","School of Psychology, Deakin University, Melbourne, Australia.","eng","Journal Article","J Sports Sci",NA,"Journal of sports sciences"
"21381847",2011,"Mar","A taxometric analysis of actual Internet sports gambling behavior.","10.1037/a0021404 [doi]","This article presents findings from the first taxometric study of actual gambling ","Braverman, Julia; LaBrie, Richard A; Shaffer, Howard J","Division on Addictions, Cambridge Health Alliance, 101 Station Landing, Medford, ","eng","Journal Article","Psychol Assess",NA,"Psychological assessment"
"20859797",2011,NA,"Theobromine and the pharmacology of cocoa.","10.1007/978-3-642-13443-2_7 [doi]","The effects of theobromine in man are underresearched, possibly owing to the ","Smit, Hendrik Jan","Functional Food Centre, Oxford Brookes University, Oxford, OX3 0BP, UK. ","eng","Journal Article; Review","Handb Exp Pharmacol",NA,"Handbook of experimental pharmacology"
"20442052",2010,"May","[The psychological factors affecting athletic performance].","10.1556/OH.2010.28890 [doi]","The physical and mental health complex is claimed as achievement of the XXI. ","Resch, Maria","Petz Aladar Megyei Oktato Korhaz, II. Pszichiatriai es Mentalhigienes Osztaly, ","hun","English Abstract; Journal Article; Review","Orv Hetil",NA,"Orvosi hetilap"
"17675908",2007,"Mar-Apr","[Detection of high-risk personalities in risky sports].",NA,"ARGUMENT: Detecting high-risk personalities involved in hazardous sports is ","Lafollie, D","Centre de Recherches en Sciences du Sport, UFR STAPS (UPRES 1609), batiment 335, ","fre","English Abstract; Journal Article","Encephale",NA,"L'Encephale"
"17474846",2007,"Apr","Characteristics of Internet use in relation to game genre in Korean adolescents.",NA,"As the number of internet users increases, a new game genre using the internet as ","Lee, Moon-Soo; Ko, Young-Hoon; Song, Hyoung-Seok; Kwon, Ku-Hyung; Lee, Hyeon-Soo; Nam, Min; Jung, In-Kwa","Department of Neuropsychiatry, Korea University College of Medicine, Seoul, ","eng","Journal Article","Cyberpsychol Behav",NA,"Cyberpsychology & behavior : the impact of the Internet, multimedia and virtual "
"17034444",2006,"Nov","Doping in fitness sports: estimated number of unreported cases and individual ",NA,"AIMS: Recent studies have suggested that the use of doping substances and ","Simon, Perikles; Striegel, Heiko; Aust, Fabian; Dietz, Klaus; Ulrich, Rolf","University of Tuebingen, Department of Sports Medicine, General Internal Medicine ","eng","Journal Article; Multicenter Study; Randomized Controlled Trial","Addiction",NA,"Addiction (Abingdon, England)"
"16303225",2006,"Mar","Are nonpharmacological induced rewards related to anhedonia? A study among ",NA,"It is well-known that persons with a drug addiction experience feelings of ","Franken, Ingmar H A; Zijlstra, Corien; Muris, Peter","Institute of Psychology, Erasmus University Rotterdam, P.O. Box 1738, 3000 DR ","eng","Comparative Study; Journal Article","Prog Neuropsychopharmacol Biol Psychiatry",NA,"Progress in neuro-psychopharmacology & biological psychiatry"
"15236810",2004,"Aug","Substance use, religiosity, and other protective factors among Hungarian ",NA,"A number of risk factors have emerged as important correlates of adolescent ","Piko, Bettina F; Fitzpatrick, Kevin M","Department of Psychiatry, Division of Behavioral Sciences, University of Szeged, ","eng","Journal Article; Research Support, Non-U.S. Gov't","Addict Behav",NA,"Addictive behaviors"
"12768900",2002,NA,"[Views on health, disease and human life].",NA,"We should not conceptualize health as a normal biological state. The WHO ","Stulhofer, Mladen","Akademija medicinskih znanosti Hrvatske Subiceva 29 10000 Zagreb, Hrvatska.","hrv","English Abstract; Journal Article","Acta Med Croatica",NA,"Acta medica Croatica : casopis Hravatske akademije medicinskih znanosti"
"12609693",2003,"Mar","Sensation seeking as a common factor in opioid dependent subjects and high risk ",NA,"OBJECTIVE: Animal research has outlined a vulnerability trait to drug dependence ","Franques, P; Auriacombe, M; Piquemal, E; Verger, M; Brisseau-Gimenez, S; Grabot, D; Tignol, J","Groupe d'etudes des Addictions, Laboratoire de Psychopathologie et ","eng","Comparative Study; Journal Article; Research Support, Non-U.S. Gov't","Drug Alcohol Depend",NA,"Drug and alcohol dependence"
"11421166",2001,"Apr","[Doping in sports].",NA,"Doping consists in the use of artificial means or substances with the unique aim ","Pirnay, F","Universite de Liege.","fre","English Abstract; Journal Article; Review","Rev Med Liege",NA,"Revue medicale de Liege"
"9488922",1997,"Nov-Dec","[Sensation seeking and anhedonia in risk taking. Study of a population of bungy ",NA,"This study presents the investigation of the relations between sensation seeking ","Michel, G; Carton, S; Jouvent, R","C.N.R.S. URA 1957 Personnalite et conduites adaptatives, Hopital de la ","fre","English Abstract; Journal Article","Encephale",NA,"L'Encephale"
"8969015",1996,"Dec","Psychological and behavioural effects of endogenous testosterone and ",NA,"Endogenous testosterone levels have been linked to aggressive behaviour in both ","Bahrke, M S; Yesalis, C E 3rd; Wright, J E","Human Kinetics, Champaign, Illinois, USA. mikeb@hkusa.com","eng","Journal Article; Review","Sports Med",NA,"Sports medicine (Auckland, N.Z.)"
"11362491",1995,"May","Study finds extremely low risk of HIV infection in football.",NA,NA,NA,NA,"eng","Newspaper Article","AIDS Policy Law",NA,"AIDS policy & law"
"7825762",1995,"Feb","Bleeding injuries in professional football: estimating the risk for HIV ",NA,"OBJECTIVE: To determine the risk for bleeding injuries in professional football ","Brown, L S Jr; Drotman, D P; Chu, A; Brown, C L Jr; Knowlan, D","Addiction Research and Treatment Corporation, Brooklyn, New York.","eng","Journal Article","Ann Intern Med",NA,"Annals of internal medicine"
"17630515",1995,"Winter","Exercise dependence: when runners don't know when to quit.",NA,"The health benefits of exercise have been extolled by health professionals. The ","Johnson, R","From Primary Care Sports Medicine and Minneapolis Sports Medicine Center, and the ","eng","Journal Article","Sports Med Arthrosc Rev",NA,"Sports medicine and arthroscopy review"
"2015642",1991,"Jan","Psychologic aspects of exercise.",NA,"Physicians are well aware of the health benefits of exercise, but probably less ","Anthony, J","Fitness and Sports Medicine Institute, Aspen Club, Colorado.","eng","Journal Article; Review","Clin Sports Med",NA,"Clinics in sports medicine"
