"Title","PMID"
"Selfitis Behavior: Assessing the Italian Version of the Selfitis Behavior Scale and Its Mediating Role in the Relationship of Dark Traits with Social Media Addiction.","32784419"
"Measuring Problematic Internet Use, Internet Gaming Disorder, and Social Media Addiction in Young Adults: Cross-sectional Survey Study.","34081596"
"Psychometric Properties of the Persian Internet Addiction Test-Social Networking Sites Version: Dimensionality Assessment of Social Networking Site Addiction.","34703530"
"The Role of Attentional Bias Toward Negative Emotional Information and Social Anxiety in Problematic Social Media Use.","36479870"
"The association of problematic use of social media and online videogames with aggression is mediated by insomnia severity: A cross-sectional study in a sample of 18- to 24-year-old individuals.","34870339"
"Face it, don't Facebook it: Impacts of Social Media Addiction on Mindfulness, Coping Strategies and the Consequence on Emotional Exhaustion.","25825273"
"The impact of WhatsApp use on academic achievement among Saudi medical students.","29909715"
"Role of Emotion in Excessive Use of Twitter During COVID-19 Imposed Lockdown in India.","33102690"
"Validation of the Social Media Disorder Scale in Adolescents: Findings From a Large-Scale Nationally Representative Sample.","34189943"
"Adult Attachment Style, Emotion Regulation, and Social Networking Sites Addiction.","31749729"
"Problematic Social Media Use: Results from a Large-Scale Nationally Representative Adolescent Sample.","28068404"
"Psychometric Testing of Three Chinese Online-Related Addictive Behavior Instruments among Hong Kong University Students.","30328020"
"Psychometric properties of three online-related addictive behavior instruments among Bangladeshi school-going adolescents.","36516198"
"The psychometric properties of Social Anxiety Scale for Adolescents (SAS-A) short form-Bangla.","34466696"
"Social Media Use and Adolescents' Sleep: A Longitudinal Study on the Protective Role of Parental Rules Regarding Internet Use before Sleep.","33540882"
"Problematic social media use is associated with depression and similar to behavioral addictions: Physiological and behavioral evidence.","37356318"
"Use of social media while driving from an orthopedic resident's perspective.","32245581"
"Revealing the Intellectual Structure and Evolution of Digital Addiction Research: An Integrated Bibliometric and Science Mapping Approach.","36429603"
"A Comparative Study on Social Media Usage and Health Status among Students Studying in Pre-University Colleges of Urban Bengaluru.","30294084"
"COVID-19 Related Distress Is Associated With Alcohol Problems, Social Media and Food Addiction Symptoms: Insights From the Italian Experience During the Lockdown.","33324256"
"Determinants of phubbing, which is the sum of many virtual addictions: a structural equation model.","26014669"
"Social epidemiology of early adolescent problematic screen use in the United States.","35768491"
"COVID-19-Related Social Isolation Predispose to Problematic Internet and Online Video Gaming Use in Italy.","35162568"
"Mediated roles of generalized trust and perceived social support in the effects of problematic social media use on mental health: A cross-sectional study.","33253480"
"The Use of Digital Technologies, Impulsivity and Psychopathological Symptoms in Adolescence.","31344851"
"The addiction behavior of short-form video app TikTok: The information quality and system quality perspective.","36148123"
"A two-generation study: The transmission of attachment and young adults' depression, anxiety, and social media addiction.","34547644"
"Social media use as a risk factor for depressive symptoms during pregnancy.","37364655"
"Validation of the Social Media Disorder Scale using network analysis in a large representative sample of Czech adolescents.","36072384"
"An exploratory study of clinical and physiological correlates of problematic social media use in adolescents.","34098156"
"A comprehensive review on emerging trends in the dynamic evolution of digital addiction and depression.","36844332"
"Turkish Adaptation of the Social Media Disorder Scale in Adolescents.","30224872"
"Internet addiction is associated with psychological distress in highly schizotypal students.","36196053"
"Structural equation modeling of direct and indirect associations of social media addiction with eating behavior in adolescents and young adults.","36810365"
"A latent profile approach for the study of internet gaming disorder, social media addiction, and psychopathology in a normative sample of adolescents.","31496849"
"Relationships between Depression, Fear of Missing Out and Social Media Addiction: The Mediating Role of Self-Esteem.","37372785"
"Cognitive Behavioral Therapy-Based Short-Term Abstinence Intervention for Problematic Social Media Use: Improved Well-Being and Underlying Mechanisms.","32989636"
"The Psychometric Properties of the Smartphone Application-Based Addiction Scale (SABAS).","29670500"
"The problematic use of social networking sites associates with elevated symptoms in patients with major depressive disorder.","32390484"
"Psychometric properties of the Utrecht Work Engagement Scale for Students (UWES-S) in the Taiwanese context.","36313583"
"Associations between executive functions and problematic social networking sites use.","32781930"
"Investigating Links Between Fear of COVID-19, Neuroticism, Social Networks Use Disorder, and Smartphone Use Disorder Tendencies.","34408703"
"Internet-Related Behaviors and Psychological Distress Among Schoolchildren During the COVID-19 School Hiatus.","33877905"
"Generalized and Specific Problematic Internet Use in Central Siberia Adolescents: A School-Based Study of Prevalence, Age-Sex Depending Content Structure, and Comorbidity with Psychosocial Problems.","35805263"
"Associations of Problematic Internet Use, Weight-Related Self-Stigma, and Nomophobia with Physical Activity: Findings from Mainland China, Taiwan, and Malaysia.","36231435"
"Mediating role of positivity in the relationship between state anxiety and problematic social media use during the COVID-19 pandemic.","33988086"
"Quality of life and mental health of adolescents: Relationships with social media addiction, Fear of Missing out, and stress associated with neglect and negative reactions by online peers.","37285351"
"The Relationship Between Technology Use and Problem Technology Use and Potential Psychosocial Mechanisms: Population-Based Telephone Survey in Community Adults During COVID-19.","34434146"
"Mediating Roles of Fear of Missing Out and Boredom Proneness on Psychological Distress and Social Media Addiction Among Indian Adolescents.","37362061"
"Factors influencing the addiction characteristics of non-suicidal self-injurious behaviors in adolescents: A case-control study.","36532167"
"Body Image Concerns: The Impact of Digital Technologies and Psychopathological Risks in a Normative Sample of Adolescents.","36004826"
"Cross-national validation of the social media disorder scale: findings from adolescents from 44 countries.","34605094"
"Understanding Detrimental Aspects of Social Media Use: Will the Real Culprits Please Stand Up?","33869524"
"Mediated effects of insomnia in the association between problematic social media use and subjective well-being among university students during COVID-19 pandemic.","35992212"
"Longitudinal Relationships between Nomophobia, Addictive Use of Social Media, and Insomnia in Adolescents.","34574975"
"Social networking use, mental health, and quality of life of Hong Kong adolescents during the COVID-19 pandemic.","36388293"
"Problematic Internet Use and Emotional Dysregulation Among Young People: A Literature Review.","34909019"
"Ephemeral but Influential? The Correlation between Facebook Stories Usage, Addiction, Narcissism, and Positive Affect.","33114709"
"Think-aloud analysis of commonly used screening instruments for Internet use disorders: The CIUS, the IGDT-10, and the BSMAS.","35895610"
"Psychometric evaluation of the Persian Internet Disorder Scale among adolescents.","30264609"
"[Study of the Background Variables of Depression Among Female University Students: The Role of Online Self-Disclosure and Social Media Addiction].","36264162"
"A three-wave panel study on longitudinal relations between problematic social media use and psychological distress during the COVID-19 pandemic.","35870439"
"Problematic Use of the Internet Mediates the Association between Reduced Mentalization and Suicidal Ideation: A Cross-Sectional Study in Young Adults.","35628085"
"Exploring Individual Differences in Online Addictions: the Role of Identity and Attachment.","28798553"
"Temporal associations between morningness/eveningness, problematic social media use, psychological distress and daytime sleepiness: Mediated roles of sleep quality and insomnia among young adults.","32406567"
"The relationship between dysfunctional metacognitive beliefs and problematic social networking sites use.","32145032"
"Psychometric Properties of Three Simplified Chinese Online-Related Addictive Behavior Instruments Among Mainland Chinese Primary School Students.","33101070"
"[The relationship between internet addiction and sleep disorders in adolescents of Central Siberia in different types of consumed content].","35759568"
"Evaluation of psychometric properties of the Arabic version of the Internet Disorder Scale (IDS-15).","36126376"
"Problematic social media use is associated with increased risk-aversion after negative outcomes in the Balloon Analogue Risk Task.","31999172"
"The associations between attachment, self-esteem, fear of missing out, daily time expenditure, and problematic social media use: A path analysis model.","36753932"
"Video game addiction in psychiatric adolescent population: A hospital-based study on the role of individualism from South China.","37325928"
"The Big Five Personality Domains and Their Facets: Empirical Relations to Problematic Use of Video Games, Social Media and Alcohol.","37366696"
"Reliability and validity of the problematic TikTok Use Scale among the general population.","37056408"
"Comparing generalized and specific problematic smartphone/internet use: Longitudinal relationships between smartphone application-based addiction and social media addiction and psychological distress.","32592655"
"Sense of Belonging at School and on Social Media in Adolescence: Associations with Educational Achievement and Psychosocial Maladjustment.","36920688"
"Problematic use of the internet, smartphones, and social media among medical students and relationship with depression: An exploratory study.","37235547"
"How are the youth? A brief-longitudinal study on symptoms, alexithymia and expressive suppression among Italian adolescents during COVID-19 pandemic.","35729091"
"The association between problematic internet use, psychological distress, and sleep problems during COVID-19.","35673626"
"Comparing Smartphone, WhatsApp, Facebook, Instagram, and Snapchat: Which Platform Elicits the Greatest Use Disorder Symptoms?","32907403"
"A preliminary study into internet related addictions among adults with dyslexia.","36827334"
"Attentional Bias Is Associated with Negative Emotions in Problematic Users of Social Media as Measured by a Dot-Probe Task.","36554818"
"Temporal associations between problematic use of the internet and self-stigma among people with substance use disorders: A cross-lagged model across one year.","36323137"
"Discussing evidence on the components model of addiction. A commentary on Fournier et al. (2023).","37307757"
"The role of metacognitions and emotion recognition in problematic SNS use among adolescents.","33387741"
"The role of desire thinking in the problematic use of social networking sites among adults.","36238695"
"Psychometric Properties of Screening Instruments for Social Network Use Disorder in Children and Adolescents: A Systematic Review.","36806892"
"Mind over Matter: Testing the Efficacy of an Online Randomized Controlled Trial to Reduce Distraction from Smartphone Use.","32635650"
"What is Your Level of Nomophobia? An Investigation of Prevalence and Level of Nomophobia Among Young People in Turkey.","31902048"
"Problematic smartphone and social media use among undergraduate students during the COVID-19 pandemic: In the case of southern Ethiopia universities.","36696412"
"Positive Youth Development Attributes and Parenting as Protective Factors Against Adolescent Social Networking Addiction in Hong Kong.","33816410"
"Effects of sleep quality on the association between problematic internet use and quality of life in people with substance use disorder.","35946067"
"Reciprocal Relationships Between Problematic Social Media Use, Problematic Gaming, and Psychological Distress Among University Students: A 9-Month Longitudinal Study.","35462841"
"Risk of disordered eating in emerging adulthood: media, body and weight-related correlates among Hungarian female university students.","35647372"
"Problematic Social Networking Site Use and Comorbid Psychiatric Disorders: A Systematic Review of Recent Large-Scale Studies.","30618866"
"Doomscrolling Scale: its Association with Personality Traits, Psychological Distress, Social Media Use, and Wellbeing.","36275044"
"Effects of a group activity-based motivational enhancement therapy program on social media addictive behaviors among junior high school students in Thailand: a cluster randomized trial.","30214329"
"A multidimensional construct of helicopter parenting and college students' game and social media addictive behaviors: A cross-cultural study in South Korea and China.","36938126"
"The relationship between the high-risk disordered eating and social network navigation among Saudi college females during the COVID pandemic.","36148353"
"Associations between adverse childhood experiences and early adolescent problematic screen use in the United States.","37349707"
"The association between parent-child relationship and problematic internet use among English- and Chinese-language studies: A meta-analysis.","36110283"
"Digital Overuse and Addictive Traits and Their Relationship With Mental Well-Being and Socio-Demographic Factors: A National Population Survey for Wales.","34222161"
"Temporal associations between physical activity and three types of problematic use of the internet: A six-month longitudinal study.","36427199"
"The association of care burden with motivation of vaccine acceptance among caregivers of stroke patients during the COVID-19 pandemic: mediating roles of problematic social media use, worry, and fear.","37183253"
"Problematic Gaming in Malaysian University Students: Translation and Psychometric Evaluation of the Malay Language Versions of Gaming Disorder Test and Gaming Disorder Scale for Young Adults.","37365830"
"Psychometric properties and development of the Chinese versions of Gaming Disorder Test (GDT) and Gaming Disorder Scale for Adolescents (GADIS-A).","37285663"
